date,link,titles,news_date,category
https://www.nytimes.com/issue/todayspaper/2019/06/04/todays-new-york-times,/2019/06/03/business/media/abortion-laws-hollywood.html,Hollywood Producer Seeks to Raise Funds to Battle Anti-Abortion Laws,2019/06/04,business
https://www.nytimes.com/issue/todayspaper/2019/06/04/todays-new-york-times,/2019/06/03/arts/television/james-holzhauer-jeopardy.html,James Holzhauer’s ‘Jeopardy!’ Streak Ends Just Shy of a Record,2019/06/04,arts
https://www.nytimes.com/issue/todayspaper/2019/06/04/todays-new-york-times,/2019/06/03/arts/music/pavarotti-ron-howard.html,Pavarotti Captured the Sublime and Vulgar Sides of Opera,2019/06/04,arts
https://www.nytimes.com/issue/todayspaper/2019/06/04/todays-new-york-times,/2019/06/03/health/sperm-banks-fertility-artificial-insemination.html,Their Children Were Conceived With Donated Sperm. It Was the Wrong Sperm.,2019/06/04,health
https://www.nytimes.com/issue/todayspaper/2019/06/05/todays-new-york-times,/2019/06/04/us/politics/republicans-mexico-tariffs.html,Senate Republicans Warn White House Against Mexico Tariffs,2019/06/05,us
https://www.nytimes.com/issue/todayspaper/2019/06/05/todays-new-york-times,/2019/06/04/us/politics/joe-biden-climate-plan.html,Climate Change Takes Center Stage as Biden and Warren Release Plans,2019/06/05,us
https://www.nytimes.com/issue/todayspaper/2019/06/05/todays-new-york-times,/2019/06/04/world/europe/brexit-trump-theresa-may.html,"As Trump Dangles Post-Brexit Trade Deal, Some Britons See Opportunism",2019/06/05,world
https://www.nytimes.com/issue/todayspaper/2019/06/05/todays-new-york-times,/2019/06/04/us/parkland-scot-peterson.html,Parkland Officer Who Stayed Outside During Shooting Faces Criminal Charges,2019/06/05,us
https://www.nytimes.com/issue/todayspaper/2019/06/05/todays-new-york-times,/2019/06/04/us/politics/fbi-domestic-terrorism.html,"F.B.I., Pushing to Stop Domestic Terrorists, Grapples With Limits on Its Power",2019/06/05,us
https://www.nytimes.com/issue/todayspaper/2019/06/05/todays-new-york-times,/2019/06/04/world/asia/tiananmen-anniversary-china.html,Tiananmen Anniversary Draws Silence in Beijing but Emotion in Hong Kong,2019/06/05,world
https://www.nytimes.com/issue/todayspaper/2019/06/05/todays-new-york-times,/2019/06/04/us/virginia-beach-shooting-ralph-northam.html,"After Another Mass Shooting, Another Virginia Governor Tries to Change Gun Laws",2019/06/05,us
https://www.nytimes.com/issue/todayspaper/2019/06/05/todays-new-york-times,/2019/06/05/business/modern-monetary-theorys-reluctant-poster-child-japan.html,Modern Monetary Theory’s Reluctant Poster Child: Japan,2019/06/05,business
https://www.nytimes.com/issue/todayspaper/2019/06/05/todays-new-york-times,/2019/06/04/business/economy/airport-workers-union.html,"11,000 People Who Prepare Your Airline Food Are Considering a Strike",2019/06/05,business
https://www.nytimes.com/issue/todayspaper/2019/06/05/todays-new-york-times,/2019/06/05/world/middleeast/palestinian-prime-minister-israel.html,New Palestinian Premier Warns of a ‘Very Hot Summer’,2019/06/05,world
https://www.nytimes.com/issue/todayspaper/2019/06/05/todays-new-york-times,/2019/06/04/us/politics/russia-election-hacking.html,"Russia Could Unleash Fake Videos During Election, Schiff Says",2019/06/05,us
https://www.nytimes.com/issue/todayspaper/2019/06/05/todays-new-york-times,/2019/06/04/nyregion/rent-laws-nyc.html,Rent Laws: Dozens Arrested at State Capitol as Debate Escalates,2019/06/05,nyregion
https://www.nytimes.com/issue/todayspaper/2019/06/05/todays-new-york-times,/2019/06/04/sports/french-open-federer-wawrinka-nadal-nishikori.html,"It’s Federer vs. Nadal, a Grand Rivalry Reborn, in the French Open Semifinals",2019/06/05,sports
https://www.nytimes.com/issue/todayspaper/2019/06/05/todays-new-york-times,/2019/06/04/arts/design/kehinde-wiley-senegal.html,Kehinde Wiley (and His Infinity Pool) Are Ready to Spoil Artists,2019/06/05,arts
https://www.nytimes.com/issue/todayspaper/2019/06/06/todays-new-york-times,/2019/06/05/us/politics/mexico-tariffs.html,Trump Says No Deal With Mexico Is Reached as Border Arrests Surge,2019/06/06,us
https://www.nytimes.com/issue/todayspaper/2019/06/06/todays-new-york-times,/2019/06/05/us/politics/fetal-tissue-research.html,Trump Administration Sharply Curtails Fetal Tissue Medical Research,2019/06/06,us
https://www.nytimes.com/issue/todayspaper/2019/06/06/todays-new-york-times,/2019/06/05/us/world-war-2-history-research-archives-.html,Their Fathers Never Spoke of the War. Their Children Want to Know Why.,2019/06/06,us
https://www.nytimes.com/issue/todayspaper/2019/06/06/todays-new-york-times,/2019/06/05/world/europe/piers-morgan-donald-trump-interview.html,Trump’s Split-Screen Persona on Blaring Display in U.K. Visit,2019/06/06,world
https://www.nytimes.com/issue/todayspaper/2019/06/06/todays-new-york-times,/2019/06/05/us/politics/amazon-apple-facebook-google-lobbying.html,Tech Giants Amass a Lobbying Army for an Epic Washington Battle,2019/06/06,us
https://www.nytimes.com/issue/todayspaper/2019/06/06/todays-new-york-times,/2019/06/05/health/navajo-children-custody-fight.html,Who Can Adopt a Native American Child? A Texas Couple vs. 573 Tribes,2019/06/06,health
https://www.nytimes.com/issue/todayspaper/2019/06/06/todays-new-york-times,/2019/06/05/business/china-richard-liu-rape-video-metoo.html,"In China, a Viral Video Sets Off a Challenge to Rape Culture",2019/06/06,business
https://www.nytimes.com/issue/todayspaper/2019/06/06/todays-new-york-times,/2019/06/05/business/fiat-renault-merger-withdrawn.html,Fiat Chrysler Withdraws Its Offer for Renault,2019/06/06,business
https://www.nytimes.com/issue/todayspaper/2019/06/06/todays-new-york-times,/2019/06/05/world/australia/journalist-raids.html,Australia May Well Be the World’s Most Secretive Democracy,2019/06/06,world
https://www.nytimes.com/issue/todayspaper/2019/06/06/todays-new-york-times,/2019/06/05/world/asia/thailand-prayuth-prime-minister.html,Thailand Junta Leader Named Prime Minister After Contentious Vote,2019/06/06,world
https://www.nytimes.com/issue/todayspaper/2019/06/06/todays-new-york-times,/2019/06/05/nyregion/ice-cream-trucks-seized-nyc.html,34 Ice Cream Trucks Towed in Midtown ‘Operation Meltdown’,2019/06/06,nyregion
https://www.nytimes.com/issue/todayspaper/2019/06/06/todays-new-york-times,/2019/06/05/us/parkland-police-bravery-coward.html,We Expect Police to Be Brave For Us. But What Happens When They’re Not?,2019/06/06,us
https://www.nytimes.com/issue/todayspaper/2019/06/06/todays-new-york-times,/2019/06/05/us/ohio-doctor-murder-fentanyl-overdose.html,Ohio Doctor Charged With Killing 25 Patients in Fentanyl Overdoses,2019/06/06,us
https://www.nytimes.com/issue/todayspaper/2019/06/06/todays-new-york-times,/2019/06/05/arts/music/bob-dylan-rolling-thunder-revue.html,Bob Dylan’s Glam Hootenanny: Returning to Rolling Thunder,2019/06/06,arts
https://www.nytimes.com/issue/todayspaper/2019/06/06/todays-new-york-times,/2019/06/04/sports/french-open-roland-garros.html,Finding an Oasis at Tennis’s Most Crowded Major,2019/06/06,sports
https://www.nytimes.com/issue/todayspaper/2019/06/07/todays-new-york-times,/2019/06/06/climate/trump-auto-emissions-rollback-letter.html,Automakers Tell Trump His Pollution Rules Could Mean ‘Untenable’ Instability and Lower Profits,2019/06/07,climate
https://www.nytimes.com/issue/todayspaper/2019/06/07/todays-new-york-times,/2019/06/06/us/politics/trump-mexico.html,Mexico and the U.S. Have Made Progress Toward Averting Tariffs,2019/06/07,us
https://www.nytimes.com/issue/todayspaper/2019/06/07/todays-new-york-times,/2019/06/06/world/europe/trump-d-day-speech.html,"Trump Honors D-Day Sacrifices, With Some Legacies Unspoken",2019/06/07,world
https://www.nytimes.com/issue/todayspaper/2019/06/07/todays-new-york-times,/2019/06/06/nyregion/stonewall-riots-nypd.html,"Stonewall Riot Apology: Police Actions Were ‘Wrong,’ Commissioner Admits",2019/06/07,nyregion
https://www.nytimes.com/issue/todayspaper/2019/06/07/todays-new-york-times,/2019/06/06/us/politics/joe-biden-hyde-amendment.html,"Joe Biden Denounces Hyde Amendment, Reversing His Position",2019/06/07,us
https://www.nytimes.com/issue/todayspaper/2019/06/07/todays-new-york-times,/2019/06/06/nyregion/west-point-accident.html,West Point Accident Kills Cadet and Injures 22 Others,2019/06/07,nyregion
https://www.nytimes.com/issue/todayspaper/2019/06/07/todays-new-york-times,/2019/06/07/us/school-racism-students.html,Few Talked About Race at This School. Then a Student Posted a Racist Slur.,2019/06/07,us
https://www.nytimes.com/issue/todayspaper/2019/06/07/todays-new-york-times,/2019/06/06/business/auto-industry-fiat-renault.html,The Car Industry Is Under Siege,2019/06/07,business
https://www.nytimes.com/issue/todayspaper/2019/06/07/todays-new-york-times,/2019/06/06/world/asia/hong-kong-gay-marriage-court.html,Gay Official Wins Court Battle for Spousal Benefits in Hong Kong,2019/06/07,world
https://www.nytimes.com/issue/todayspaper/2019/06/07/todays-new-york-times,/2019/06/06/world/africa/sudan-protests-military-crackdown.html,Sudan Pro-Democracy Groups Vow to Continue Protests After Deadly Crackdown,2019/06/07,world
https://www.nytimes.com/issue/todayspaper/2019/06/07/todays-new-york-times,/2019/06/06/us/politics/democrats-2020-donations-silicon-valley.html,"Democratic Candidates Woo Silicon Valley for Donations, Then Bash It",2019/06/07,us
https://www.nytimes.com/issue/todayspaper/2019/06/07/todays-new-york-times,/2019/06/06/us/scot-peterson-parkland-shooting.html,Scot Peterson Is Released on Bond. Here’s How He’s Explained His Actions During the Parkland Shooting.,2019/06/07,us
https://www.nytimes.com/issue/todayspaper/2019/06/07/todays-new-york-times,/2019/06/06/us/north-carolina-gerrymander-republican.html,"Deceased Strategist’s Files Detail Republican Gerrymandering in North Carolina, Advocates Say",2019/06/07,us
https://www.nytimes.com/issue/todayspaper/2019/06/07/todays-new-york-times,/2019/06/06/us/politics/tariffs-trade.html,"Tariff Threats Aside, the Senate Is Where Action Goes to Die",2019/06/07,us
https://www.nytimes.com/issue/todayspaper/2019/06/07/todays-new-york-times,/2019/06/06/obituaries/dr-john-dies.html,"Dr. John, of Voodoo Beads, Feathers and New Orleans Sound, Dies at 77",2019/06/07,obituaries
https://www.nytimes.com/issue/todayspaper/2019/06/07/todays-new-york-times,/2019/06/05/business/media/tariffs-retail-clothes-everlane.html,How China Tariffs Could Make Your Sweaters and Pants Cost More,2019/06/07,business
https://www.nytimes.com/issue/todayspaper/2019/06/07/todays-new-york-times,/2019/06/06/business/huawei-russia-5g.html,"Huawei, Shunned by U.S. Government, Is Welcomed in Russia",2019/06/07,business
https://www.nytimes.com/issue/todayspaper/2019/06/07/todays-new-york-times,/2019/06/07/sports/amanda-anisimova-french-open.html,"Amanda Anisimova, Playing Fearlessly, Nears an Early Breakthrough",2019/06/07,sports
https://www.nytimes.com/issue/todayspaper/2019/06/08/todays-new-york-times,/2019/06/07/us/politics/trump-tariffs-mexico.html,Trump Calls Off Plan to Impose Tariffs on Mexico,2019/06/08,us
https://www.nytimes.com/issue/todayspaper/2019/06/08/todays-new-york-times,/2019/06/07/business/economy/may-jobs-report-economy.html,A Weak Jobs Report Poses a New Challenge to Trump: A Slowing Economy,2019/06/08,business
https://www.nytimes.com/issue/todayspaper/2019/06/08/todays-new-york-times,/2019/06/08/us/politics/migrants-drown-rio-grande.html,Death on the Rio Grande: A Look at a Perilous Migrant Route,2019/06/08,us
https://www.nytimes.com/issue/todayspaper/2019/06/08/todays-new-york-times,/2019/06/07/us/saudi-arabia-arms-sales-raytheon.html,Trump Allows High-Tech U.S. Bomb Parts to Be Built in Saudi Arabia,2019/06/08,us
https://www.nytimes.com/issue/todayspaper/2019/06/08/todays-new-york-times,/2019/06/07/us/columbine-high-school-demolition.html,Columbine High School Could Be Torn Down to Deter Copycats,2019/06/08,us
https://www.nytimes.com/issue/todayspaper/2019/06/08/todays-new-york-times,/2019/06/07/health/drug-companies-antibiotics-resistance.html,Warning of ‘Pig Zero’: One Drugmaker’s Push to Sell More Antibiotics,2019/06/08,health
https://www.nytimes.com/issue/todayspaper/2019/06/08/todays-new-york-times,/2019/06/07/sports/womens-world-cup-france-korea.html,France Revels as It Opens the World Cup With a Victory,2019/06/08,sports
https://www.nytimes.com/issue/todayspaper/2019/06/08/todays-new-york-times,/2019/06/07/world/asia/hong-kong-china-extradition-protest.html,"Fearing China’s Rule, Hong Kong Residents Resist Extradition Plan",2019/06/08,world
https://www.nytimes.com/issue/todayspaper/2019/06/08/todays-new-york-times,/2019/06/07/world/asia/china-journalist-liu-wanyong.html,"For China’s Leading Investigative Reporter, Enough Is Enough",2019/06/08,world
https://www.nytimes.com/issue/todayspaper/2019/06/08/todays-new-york-times,/2019/06/07/sports/raptors-warriors-score.html,The Raptors Won Game 4 and Are 1 Win From an N.B.A. Championship,2019/06/08,sports
https://www.nytimes.com/issue/todayspaper/2019/06/08/todays-new-york-times,/2019/06/07/nyregion/times-square-plot-attack.html,"Times Square Terror Plot: Inspired by Bin Laden, Man Planned Bombing, Officials Say",2019/06/08,nyregion
https://www.nytimes.com/issue/todayspaper/2019/06/08/todays-new-york-times,/2019/06/07/science/space-station-nasa.html,Want to Buy a Ticket to the Space Station? NASA Says Soon You Can,2019/06/08,science
https://www.nytimes.com/issue/todayspaper/2019/06/08/todays-new-york-times,/2019/06/07/business/economy/age-discrimination-jobs-hiring.html,"New Evidence of Age Bias in Hiring, and a Push to Fight It",2019/06/08,business
https://www.nytimes.com/issue/todayspaper/2019/06/08/todays-new-york-times,/2019/06/07/us/politics/biden-abortion-hyde-amendment.html,"Behind Biden’s Reversal on Hyde Amendment: Lobbying, Backlash and an Ally’s Call",2019/06/08,us
https://www.nytimes.com/issue/todayspaper/2019/06/08/todays-new-york-times,/2019/06/07/us/alabama-university-culverhouse-donation.html,University of Alabama Returns Largest-Ever Gift to Donor,2019/06/08,us
https://www.nytimes.com/issue/todayspaper/2019/06/08/todays-new-york-times,/2019/06/07/us/minneapolis-police-sentencing-mohamed-noor.html,Somali-American Police Officer Sentenced to 12.5 Years in Death of Minneapolis Woman,2019/06/08,us
https://www.nytimes.com/issue/todayspaper/2019/06/09/todays-new-york-times,/2019/06/08/us/politics/trump-mexico-deal-tariffs.html,Mexico Agreed to Take Border Actions Months Before Trump Announced Tariff Deal,2019/06/09,us
https://www.nytimes.com/issue/todayspaper/2019/06/09/todays-new-york-times,/2019/06/08/upshot/politicians-draw-clear-lines-on-abortion-their-parties-are-not-so-unified.html,Politicians Draw Clear Lines on Abortion. Their Parties Are Not So Unified.,2019/06/09,upshot
https://www.nytimes.com/issue/todayspaper/2019/06/09/todays-new-york-times,/interactive/2019/06/08/technology/youtube-radical.html,The Making of a YouTube Radical,2019/06/09,technology
https://www.nytimes.com/issue/todayspaper/2019/06/09/todays-new-york-times,/2019/06/09/us/politics/a-drama-of-trumps-own-making-ends-with-a-familiar-hero.html,A Drama of Trump’s Own Making Ends With a Familiar Hero,2019/06/09,us
https://www.nytimes.com/issue/todayspaper/2019/06/09/todays-new-york-times,/2019/06/08/nyregion/nicky-barnes-dead.html,"Nicky Barnes, ‘Mr. Untouchable’ of Heroin Dealers, Is Dead at 78",2019/06/09,nyregion
https://www.nytimes.com/issue/todayspaper/2019/06/09/todays-new-york-times,/2019/06/09/world/asia/japan-day-care.html,Japan Desperately Needs More Day Care Workers. New Mothers Need Not Apply.,2019/06/09,world
https://www.nytimes.com/issue/todayspaper/2019/06/09/todays-new-york-times,/2019/06/08/business/economy/china-huawei-trump.html,China Summons Tech Giants to Warn Against Cooperating With Trump Ban,2019/06/09,business
https://www.nytimes.com/issue/todayspaper/2019/06/09/todays-new-york-times,/2019/06/08/business/trump-economy-national-security.html,"Trump Mixes Economic and National Security, Plunging the U.S. Into Multiple Fights",2019/06/09,business
https://www.nytimes.com/issue/todayspaper/2019/06/09/todays-new-york-times,/2019/06/08/us/college-protests-dobetter.html,New Wave of Student Activism Presses Colleges on Sexual Assault,2019/06/09,us
https://www.nytimes.com/issue/todayspaper/2019/06/09/todays-new-york-times,/2019/06/06/business/nba-wealth-manager-klay-thompson-joe-mclean.html,Meet the Money Whisperer to the Super-Rich N.B.A. Elite,2019/06/09,business
https://www.nytimes.com/issue/todayspaper/2019/06/09/todays-new-york-times,/2019/06/08/sports/french-open-ashleigh-barty-marketa-vondrousova.html,Ashleigh Barty Wins the French Open for Her First Grand Slam Singles Title,2019/06/09,sports
https://www.nytimes.com/issue/todayspaper/2019/06/10/todays-new-york-times,/2019/06/09/us/politics/who-is-william-barr.html,People Are Trying to Figure Out William Barr. He’s Busy Stockpiling Power.,2019/06/10,us
https://www.nytimes.com/issue/todayspaper/2019/06/10/todays-new-york-times,/2019/06/09/world/africa/sudan-protest-crackdown.html,"Sudan Protesters, Devastated but Defiant, Regroup Underground After Crackdown",2019/06/10,world
https://www.nytimes.com/issue/todayspaper/2019/06/10/todays-new-york-times,/2019/06/09/world/asia/hong-kong-extradition-protest.html,Hong Kong March: Vast Protest of Extradition Bill Shows Fear of Eroding Freedoms,2019/06/10,world
https://www.nytimes.com/issue/todayspaper/2019/06/10/todays-new-york-times,/2019/06/09/us/politics/john-dowd-voice-mail.html,"Trump Lawyer’s Message Was a Clue for Mueller, Who Set It Aside",2019/06/10,us
https://www.nytimes.com/issue/todayspaper/2019/06/10/todays-new-york-times,/2019/06/09/nyregion/new-york-group-home-abuse.html,Residents Cowered While Workers at a Group Home Smacked and Pushed Them,2019/06/10,nyregion
https://www.nytimes.com/issue/todayspaper/2019/06/10/todays-new-york-times,/interactive/2019/06/09/us/politics/2020-democractic-candidates-ages.html,"How Old Should a President Be? With So Many Choices, Democrats Are Sharply Divided",2019/06/10,us
https://www.nytimes.com/issue/todayspaper/2019/06/10/todays-new-york-times,/2019/06/09/us/portland-climate-change.html,"As Students Clamor for More on Climate Change, Portland Heeds the Call",2019/06/10,us
https://www.nytimes.com/issue/todayspaper/2019/06/10/todays-new-york-times,/2019/06/10/us/border-migrants-medical-health-doctors.html,"Migrants in Custody at Hospitals Are Treated Like Felons, Doctors Say",2019/06/10,us
https://www.nytimes.com/issue/todayspaper/2019/06/10/todays-new-york-times,/2019/06/09/world/middleeast/saudi-teenager-death-sentence.html,Saudi Teenager Faces Death Sentence for Acts When He Was 10,2019/06/10,world
https://www.nytimes.com/issue/todayspaper/2019/06/10/todays-new-york-times,/2019/06/09/world/americas/pride-flags-us-embassies.html,Pride Flags and Foreign Policy: U.S. Diplomats See Shift on Gay Rights,2019/06/10,world
https://www.nytimes.com/issue/todayspaper/2019/06/10/todays-new-york-times,/2019/06/10/nyregion/rent-laws-landlords-strategy.html,Inside the Stealth Campaign for ‘Responsible Rent Reform’,2019/06/10,nyregion
https://www.nytimes.com/issue/todayspaper/2019/06/10/todays-new-york-times,/2019/06/09/sports/stanley-cup-st-louis-blues-boston-bruins.html,Stanley Cup Finals Headed to Game 7 After Bruins Wallop Blues,2019/06/10,sports
https://www.nytimes.com/issue/todayspaper/2019/06/10/todays-new-york-times,/2019/06/09/sports/french-open-rafael-nadal-dominic-thiem.html,"Rafael Nadal, Pillar of Roland Garros, Wins the French Open for the 12th Time",2019/06/10,sports
https://www.nytimes.com/issue/todayspaper/2019/06/10/todays-new-york-times,/2019/06/10/sports/suiting-up-hockeys-stars-one-stitch-at-a-time.html,"Suiting Up Hockey’s Stars, One Stitch at a Time",2019/06/10,sports
https://www.nytimes.com/issue/todayspaper/2019/06/10/todays-new-york-times,/2019/06/09/business/wall-street-federal-reserve-interest-rates.html,"Wall Street Asks When, Not if, the Fed Will Cut Interest Rates",2019/06/10,business
https://www.nytimes.com/issue/todayspaper/2019/06/10/todays-new-york-times,/2019/06/09/business/dealbook/united-technologies-raytheon-deal.html,United Technologies and Raytheon to Combine Into Aerospace and Military Giant,2019/06/10,business
https://www.nytimes.com/issue/todayspaper/2019/06/11/todays-new-york-times,/2019/06/10/us/politics/mueller-judiciary-committee.html,Justice Dept. Agrees to Turn Over Key Mueller Evidence to House,2019/06/11,us
https://www.nytimes.com/issue/todayspaper/2019/06/11/todays-new-york-times,/2019/06/10/us/politics/trump-mexico-tariffs-china.html,"Trump Says Mexico Tariffs Worked, Emboldening Trade Fight With China",2019/06/11,us
https://www.nytimes.com/issue/todayspaper/2019/06/11/todays-new-york-times,/2019/06/10/technology/big-tech-antitrust-scrutiny.html,Anger at Big Tech Unites Noodle Pullers and Code Writers,2019/06/11,technology
https://www.nytimes.com/issue/todayspaper/2019/06/11/todays-new-york-times,/2019/06/10/us/southern-baptist-convention-sex-abuse.html,Her Evangelical Megachurch Was Her World. Then Her Daughter Said She Was Molested by a Minister.,2019/06/11,us
https://www.nytimes.com/issue/todayspaper/2019/06/11/todays-new-york-times,/2019/06/10/nyregion/pilot-dies-helicopter-crash.html,Pilot Is Killed in Helicopter Crash on Roof of New York City Building,2019/06/11,nyregion
https://www.nytimes.com/issue/todayspaper/2019/06/11/todays-new-york-times,/2019/06/10/us/flooding-river-shipping.html,Paralysis on America’s Rivers: There’s Too Much Water,2019/06/11,us
https://www.nytimes.com/issue/todayspaper/2019/06/11/todays-new-york-times,/2019/06/10/us/politics/elizabeth-warren-2020-policies-platform.html,"Elizabeth Warren Has Lots of Plans. Together, They Would Remake the Economy.",2019/06/11,us
https://www.nytimes.com/issue/todayspaper/2019/06/11/todays-new-york-times,/2019/06/10/us/politics/immigration-mexico-deal-trump.html,"No Secret Immigration Deal Exists With U.S., Mexico’s Foreign Minister Says",2019/06/11,us
https://www.nytimes.com/issue/todayspaper/2019/06/11/todays-new-york-times,/2019/06/10/world/asia/sewol-ferry-accident.html,An Overloaded Ferry Flipped and Drowned Hundreds of Schoolchildren. Could It Happen Again?,2019/06/11,world
https://www.nytimes.com/issue/todayspaper/2019/06/11/todays-new-york-times,/2019/06/10/world/asia/hong-kong-carrie-lam-extradition.html,"Hong Kong Leader, Carrie Lam, Says She Won’t Back Down on Extradition Bill",2019/06/11,world
https://www.nytimes.com/issue/todayspaper/2019/06/11/todays-new-york-times,/2019/06/10/nyregion/stonewall-riots-apology-nypd.html,The Story Behind the Police Commissioner’s Handwritten Stonewall Apology,2019/06/11,nyregion
https://www.nytimes.com/issue/todayspaper/2019/06/11/todays-new-york-times,/2019/06/10/business/economy/trump-attacks-fed-interest-rates.html,"Trump Renews Attacks on Fed, Putting Central Bank in a Bind",2019/06/11,business
https://www.nytimes.com/issue/todayspaper/2019/06/11/todays-new-york-times,/2019/06/11/technology/online-dark-web-drug-markets.html,Dark Web Drug Sellers Dodge Police Crackdowns,2019/06/11,technology
https://www.nytimes.com/issue/todayspaper/2019/06/11/todays-new-york-times,/interactive/2019/06/10/climate/dengue-mosquito-spread-map.html,"How Dengue, a Deadly Mosquito-Borne Disease, Could Spread in a Warming World",2019/06/11,climate
https://www.nytimes.com/issue/todayspaper/2019/06/11/todays-new-york-times,/2019/06/10/us/politics/customs-data-breach.html,Border Agency’s Images of Travelers Stolen in Hack,2019/06/11,us
https://www.nytimes.com/issue/todayspaper/2019/06/11/todays-new-york-times,/2019/06/10/sports/warriors-raptors.html,How the Warriors Survived Game 5 of the N.B.A. Finals,2019/06/11,sports
https://www.nytimes.com/issue/todayspaper/2019/06/11/todays-new-york-times,/2019/06/10/sports/thailand-uswnt-womens-world-cup.html,Thailand’s World Cup Formula: A Wealthy Donor and a Rival’s Doping,2019/06/11,sports
https://www.nytimes.com/issue/todayspaper/2019/06/11/todays-new-york-times,/2019/06/10/sports/tennis-women-men-french-open.html,"While the Women’s Game Is in Upheaval, the Big 3 Men Still Dominate",2019/06/11,sports
https://www.nytimes.com/issue/todayspaper/2019/06/12/todays-new-york-times,/2019/06/11/nyregion/rent-protection-regulation.html,Landmark Deal Reached on Rent Protections for Tenants in N.Y.,2019/06/12,nyregion
https://www.nytimes.com/issue/todayspaper/2019/06/12/todays-new-york-times,/2019/06/11/business/sprint-tmobile-merger.html,Sprint and T-Mobile Merger Faces New Hurdle With Lawsuit by States,2019/06/12,business
https://www.nytimes.com/issue/todayspaper/2019/06/12/todays-new-york-times,/2019/06/11/us/california-ranch-wildfire-wasp-nest.html,He Tried to Plug a Wasp Nest. He Ended Up Sparking California’s Biggest Wildfire.,2019/06/12,us
https://www.nytimes.com/issue/todayspaper/2019/06/12/todays-new-york-times,/2019/06/11/us/politics/iowa-trump-biden.html,Trump and Biden Get Personal in Iowa Skirmish,2019/06/12,us
https://www.nytimes.com/issue/todayspaper/2019/06/12/todays-new-york-times,/2019/06/11/us/israel-birthright-jews-protests.html,"Birthright Trips, a Rite of Passage for Many Jews, Are Now a Target of Protests",2019/06/12,us
https://www.nytimes.com/issue/todayspaper/2019/06/12/todays-new-york-times,/2019/06/11/world/americas/brazil-cuba-doctors-jair-bolsonaro.html,"Brazil Fails to Replace Cuban Doctors, Hurting Health Care of 28 Million",2019/06/12,world
https://www.nytimes.com/issue/todayspaper/2019/06/12/todays-new-york-times,/2019/06/11/sports/uswnt-thailand-score.html,U.S. Takes Apart Thailand and the Record Book at the Women’s World Cup,2019/06/12,sports
