date,link,titles,news_date,category
https://www.nytimes.com/issue/todayspaper/2019/04/22/todays-new-york-times,/2019/04/21/health/medicare-for-all-hospitals.html,Hospitals Stand to Lose Billions Under ‘Medicare for All’,2019/04/22,health
https://www.nytimes.com/issue/todayspaper/2019/04/22/todays-new-york-times,/2019/04/19/sports/knicks-durant-kyrie-dolan.html,Knicks Fans Dream of Durant and Irving. Will Dolan Be the Nightmare?,2019/04/22,sports
https://www.nytimes.com/issue/todayspaper/2019/04/22/todays-new-york-times,/2019/04/22/sports/kenyan-runners.html,"For Kenyan Runners, Winning Can Be a Road to Ruin",2019/04/22,sports
https://www.nytimes.com/issue/todayspaper/2019/04/23/todays-new-york-times,/2019/04/22/world/asia/ntj-warning-sri-lanka-government.html,Sri Lanka Was Warned of Possible Attacks. Why Didn’t It Stop Them?,2019/04/23,world
https://www.nytimes.com/issue/todayspaper/2019/04/23/todays-new-york-times,/2019/04/22/world/asia/sri-lanka-blast-victims.html,Sri Lankans Mourn Victims of Easter Sunday Bombings,2019/04/23,world
https://www.nytimes.com/issue/todayspaper/2019/04/23/todays-new-york-times,/2019/04/22/us/politics/impeaching-trump-pelosi.html,Pelosi Urges Caution on Impeachment as Some Democrats Push to Begin,2019/04/23,us
https://www.nytimes.com/issue/todayspaper/2019/04/23/todays-new-york-times,/2019/04/22/us/politics/supreme-court-gay-transgender-employees.html,Supreme Court to Decide Whether Landmark Civil Rights Law Applies to Gay and Transgender Workers,2019/04/23,us
https://www.nytimes.com/issue/todayspaper/2019/04/23/todays-new-york-times,/2019/04/22/world/middleeast/us-iran-oil-sanctions-.html,"U.S. Moves to Stop All Nations From Buying Iranian Oil, but China Is Defiant",2019/04/23,world
https://www.nytimes.com/issue/todayspaper/2019/04/23/todays-new-york-times,/2019/04/22/us/politics/trump-herman-cain-federal-reserve.html,"As Herman Cain Bows Out of Fed Contention, Focus Shifts to Stephen Moore",2019/04/23,us
https://www.nytimes.com/issue/todayspaper/2019/04/23/todays-new-york-times,/2019/04/22/us/politics/mcgahn-trump-attacks.html,"As McGahn Emerges as Chief Witness in the Mueller Report, Trump and Allies Ramp Up Attacks",2019/04/23,us
https://www.nytimes.com/issue/todayspaper/2019/04/23/todays-new-york-times,/2019/04/22/science/asia-otters-pets-japan.html,These Otters Are Popular Pets in Asia. That May Be Their Undoing.,2019/04/23,science
https://www.nytimes.com/issue/todayspaper/2019/04/23/todays-new-york-times,/2019/04/22/business/china-pigs-african-swine-fever.html,"A Vicious, Untreatable Killer Leaves China Guessing",2019/04/23,business
https://www.nytimes.com/issue/todayspaper/2019/04/23/todays-new-york-times,/2019/04/22/us/politics/social-security-medicare-insolvency.html,"Social Security and Medicare Funds Face Insolvency, Report Finds",2019/04/23,us
https://www.nytimes.com/issue/todayspaper/2019/04/23/todays-new-york-times,/2019/04/22/us/politics/amy-klobuchar-2020-president.html,Amy Klobuchar’s Big Idea: Bipartisan Appeal Can Beat Trump,2019/04/23,us
https://www.nytimes.com/issue/todayspaper/2019/04/23/todays-new-york-times,/2019/04/22/us/militia-border-new-mexico.html,"Militia in New Mexico Planned to Kill Obama and Clinton, F.B.I. Was Told",2019/04/23,us
https://www.nytimes.com/issue/todayspaper/2019/04/23/todays-new-york-times,/2019/04/22/world/australia/immigration.html,Why Has Australia Fallen Out of Love With Immigration?,2019/04/23,world
https://www.nytimes.com/issue/todayspaper/2019/04/23/todays-new-york-times,/2019/04/21/arts/music/kanye-west-coachella.html,"At Coachella, the Gospel According to Kanye West",2019/04/23,arts
https://www.nytimes.com/issue/todayspaper/2019/04/23/todays-new-york-times,/2019/04/22/arts/design/artbuilt-brooklyn-army-terminal.html,Displaced Artists Open a New Front at the Brooklyn Army Terminal,2019/04/23,arts
https://www.nytimes.com/issue/todayspaper/2019/04/23/todays-new-york-times,/2019/04/22/nyregion/ramapough-lenape-indians-mahwah-nj.html,Native Americans Find Surprising Ally in N.J. Fight: Trump Administration,2019/04/23,nyregion
https://www.nytimes.com/issue/todayspaper/2019/04/24/todays-new-york-times,/2019/04/24/us/politics/donald-trump-subpoenas.html,"Trump Vows Stonewall of ‘All’ House Subpoenas, Setting Up Fight Over Powers",2019/04/24,us
https://www.nytimes.com/issue/todayspaper/2019/04/24/todays-new-york-times,/2019/04/24/technology/facebook-ftc-fine-privacy.html,Facebook Expects to Be Fined Up to $5 Billion by F.T.C. Over Privacy Issues,2019/04/24,technology
https://www.nytimes.com/issue/todayspaper/2019/04/24/todays-new-york-times,/2019/04/24/world/asia/sri-lanka-bombers-millionaire.html,Sri Lanka Suicide Bombers Included Two Sons of a Spice Tycoon,2019/04/24,world
https://www.nytimes.com/issue/todayspaper/2019/04/24/todays-new-york-times,/2019/04/24/technology/ecuador-surveillance-cameras-police-government.html,"Made in China, Exported to the World: The Surveillance State",2019/04/24,technology
https://www.nytimes.com/issue/todayspaper/2019/04/24/todays-new-york-times,/2019/04/24/us/politics/russia-2020-election-trump.html,"In Push for 2020 Election Security, Top Official Was Warned: Don’t Tell Trump",2019/04/24,us
https://www.nytimes.com/issue/todayspaper/2019/04/24/todays-new-york-times,/2019/04/24/us/politics/democrats-impeaching-trump-division.html,"Divided on Impeaching Trump, Democrats Wrestle With Duty and Politics",2019/04/24,us
https://www.nytimes.com/issue/todayspaper/2019/04/24/todays-new-york-times,/2019/04/24/world/asia/sri-lankas-muslims.html,Sri Lanka’s Muslims Face an Angry Backlash After Easter Sunday Attacks,2019/04/24,world
https://www.nytimes.com/issue/todayspaper/2019/04/24/todays-new-york-times,/2019/04/24/health/artificial-speech-brain-injury.html,Scientists Create Speech From Brain Signals,2019/04/24,health
https://www.nytimes.com/issue/todayspaper/2019/04/24/todays-new-york-times,/2019/04/24/business/boeing-stock-earnings.html,Boeing Reports Slide in Earnings and Admits Future Is Hazy,2019/04/24,business
https://www.nytimes.com/issue/todayspaper/2019/04/24/todays-new-york-times,/2019/04/24/world/europe/volodomyr-zelensky-ukraine-jewish-president.html,Ukraine’s Newly Elected President Is Jewish. So Is Its Prime Minister. Not All Jews There Are Pleased.,2019/04/24,world
https://www.nytimes.com/issue/todayspaper/2019/04/24/todays-new-york-times,/2019/04/25/us/tire-chalk-parking-unconstitutional.html,"Lose the Chalk, Officer: Court Finds Marking Tires of Parked Cars Unconstitutional",2019/04/24,us
https://www.nytimes.com/issue/todayspaper/2019/04/24/todays-new-york-times,/2019/04/24/us/james-byrd-jr-john-william-king.html,Texas Executes White Supremacist for 1998 Dragging Death of James Byrd Jr.,2019/04/24,us
https://www.nytimes.com/issue/todayspaper/2019/04/24/todays-new-york-times,/2019/04/24/health/measles-outbreaks-us.html,"Measles Outbreak Infects 695, Highest Number Since 2000",2019/04/24,health
https://www.nytimes.com/issue/todayspaper/2019/04/24/todays-new-york-times,/2019/04/24/nyregion/bridget-anne-kelly-gwb-chris-christie.html,She Was Loyal to Chris Christie. Now She Will Go to Prison for Bridgegate.,2019/04/24,nyregion
https://www.nytimes.com/issue/todayspaper/2019/04/24/todays-new-york-times,/2019/04/24/sports/2019-nfl-draft-preview.html,N.F.L. Draft 2019: Kyler Murray and Others to Watch,2019/04/24,sports
https://www.nytimes.com/issue/todayspaper/2019/04/24/todays-new-york-times,/2019/04/24/sports/damian-lillard-portland-trail-blazers.html,Damian Lillard From 37 Feet … and the Blazers Eliminate the Thunder,2019/04/24,sports
https://www.nytimes.com/issue/todayspaper/2019/04/24/todays-new-york-times,/2019/04/24/style/barbie-fashion-clothing-designer.html,The Chic Octogenarian Behind Barbie’s Best Looks,2019/04/24,style
https://www.nytimes.com/issue/todayspaper/2019/04/24/todays-new-york-times,/2019/04/22/fashion/biodegradable-clothing-sustainability.html,"Hello, Little Microbe. Doesn’t This Jacket Look Yummy?",2019/04/24,fashion
https://www.nytimes.com/issue/todayspaper/2019/04/24/todays-new-york-times,/2019/04/24/theater/ink-review.html,"Review: In ‘Ink,’ a Mephistopheles Named Murdoch Takes Charge",2019/04/24,theater
https://www.nytimes.com/issue/todayspaper/2019/04/25/todays-new-york-times,/2019/04/24/us/politics/donald-trump-subpoenas.html,"Trump Vows Stonewall of ‘All’ House Subpoenas, Setting Up Fight Over Powers",2019/04/25,us
https://www.nytimes.com/issue/todayspaper/2019/04/25/todays-new-york-times,/2019/04/24/technology/facebook-ftc-fine-privacy.html,Facebook Expects to Be Fined Up to $5 Billion by F.T.C. Over Privacy Issues,2019/04/25,technology
https://www.nytimes.com/issue/todayspaper/2019/04/25/todays-new-york-times,/2019/04/24/world/asia/sri-lanka-bombers-millionaire.html,Sri Lanka Suicide Bombers Included Two Sons of a Spice Tycoon,2019/04/25,world
https://www.nytimes.com/issue/todayspaper/2019/04/25/todays-new-york-times,/2019/04/24/technology/ecuador-surveillance-cameras-police-government.html,"Made in China, Exported to the World: The Surveillance State",2019/04/25,technology
https://www.nytimes.com/issue/todayspaper/2019/04/25/todays-new-york-times,/2019/04/24/us/politics/russia-2020-election-trump.html,"In Push for 2020 Election Security, Top Official Was Warned: Don’t Tell Trump",2019/04/25,us
https://www.nytimes.com/issue/todayspaper/2019/04/25/todays-new-york-times,/2019/04/24/us/politics/democrats-impeaching-trump-division.html,"Divided on Impeaching Trump, Democrats Wrestle With Duty and Politics",2019/04/25,us
https://www.nytimes.com/issue/todayspaper/2019/04/25/todays-new-york-times,/2019/04/24/world/asia/sri-lankas-muslims.html,Sri Lanka’s Muslims Face an Angry Backlash After Easter Sunday Attacks,2019/04/25,world
https://www.nytimes.com/issue/todayspaper/2019/04/25/todays-new-york-times,/2019/04/24/health/artificial-speech-brain-injury.html,Scientists Create Speech From Brain Signals,2019/04/25,health
https://www.nytimes.com/issue/todayspaper/2019/04/25/todays-new-york-times,/2019/04/24/business/boeing-stock-earnings.html,Boeing Reports Slide in Earnings and Admits Future Is Hazy,2019/04/25,business
https://www.nytimes.com/issue/todayspaper/2019/04/25/todays-new-york-times,/2019/04/24/world/europe/volodomyr-zelensky-ukraine-jewish-president.html,Ukraine’s Newly Elected President Is Jewish. So Is Its Prime Minister. Not All Jews There Are Pleased.,2019/04/25,world
https://www.nytimes.com/issue/todayspaper/2019/04/25/todays-new-york-times,/2019/04/25/us/tire-chalk-parking-unconstitutional.html,"Lose the Chalk, Officer: Court Finds Marking Tires of Parked Cars Unconstitutional",2019/04/25,us
https://www.nytimes.com/issue/todayspaper/2019/04/25/todays-new-york-times,/2019/04/24/us/james-byrd-jr-john-william-king.html,Texas Executes White Supremacist for 1998 Dragging Death of James Byrd Jr.,2019/04/25,us
https://www.nytimes.com/issue/todayspaper/2019/04/25/todays-new-york-times,/2019/04/24/health/measles-outbreaks-us.html,"Measles Outbreak Infects 695, Highest Number Since 2000",2019/04/25,health
https://www.nytimes.com/issue/todayspaper/2019/04/25/todays-new-york-times,/2019/04/24/nyregion/bridget-anne-kelly-gwb-chris-christie.html,She Was Loyal to Chris Christie. Now She Will Go to Prison for Bridgegate.,2019/04/25,nyregion
https://www.nytimes.com/issue/todayspaper/2019/04/25/todays-new-york-times,/2019/04/24/sports/2019-nfl-draft-preview.html,N.F.L. Draft 2019: Kyler Murray and Others to Watch,2019/04/25,sports
https://www.nytimes.com/issue/todayspaper/2019/04/25/todays-new-york-times,/2019/04/24/sports/damian-lillard-portland-trail-blazers.html,Damian Lillard From 37 Feet … and the Blazers Eliminate the Thunder,2019/04/25,sports
https://www.nytimes.com/issue/todayspaper/2019/04/25/todays-new-york-times,/2019/04/24/style/barbie-fashion-clothing-designer.html,The Chic Octogenarian Behind Barbie’s Best Looks,2019/04/25,style
https://www.nytimes.com/issue/todayspaper/2019/04/25/todays-new-york-times,/2019/04/22/fashion/biodegradable-clothing-sustainability.html,"Hello, Little Microbe. Doesn’t This Jacket Look Yummy?",2019/04/25,fashion
https://www.nytimes.com/issue/todayspaper/2019/04/25/todays-new-york-times,/2019/04/24/theater/ink-review.html,"Review: In ‘Ink,’ a Mephistopheles Named Murdoch Takes Charge",2019/04/25,theater
https://www.nytimes.com/issue/todayspaper/2019/04/26/todays-new-york-times,/2019/04/25/us/politics/joe-biden-2020-announcement.html,"Joe Biden Announces 2020 Run for President, After Months of Hesitation",2019/04/26,us
https://www.nytimes.com/issue/todayspaper/2019/04/26/todays-new-york-times,/2019/04/25/world/asia/isis-sri-lanka.html,Sri Lanka Attack Signals ISIS’ Widening Reach,2019/04/26,world
https://www.nytimes.com/issue/todayspaper/2019/04/26/todays-new-york-times,/2019/04/25/world/asia/sri-lanka-attacks-mastermind.html,Sri Lankan Accused of Leading Attacks Preached Slaughter. Many Dismissed Him.,2019/04/26,world
https://www.nytimes.com/issue/todayspaper/2019/04/26/todays-new-york-times,/2019/04/25/us/politics/joe-biden-anita-hill.html,"Joe Biden Expresses Regret to Anita Hill, but She Says ‘I’m Sorry’ Is Not Enough",2019/04/26,us
https://www.nytimes.com/issue/todayspaper/2019/04/26/todays-new-york-times,/2019/04/25/us/san-francisco-school-segregation.html,San Francisco Had an Ambitious Plan to Tackle School Segregation. It Made It Worse.,2019/04/26,us
https://www.nytimes.com/issue/todayspaper/2019/04/26/todays-new-york-times,/2019/04/25/business/china-belt-and-road-infrastructure.html,China Retools Vast Global Building Push Criticized as Bloated and Predatory,2019/04/26,business
https://www.nytimes.com/issue/todayspaper/2019/04/26/todays-new-york-times,/2019/04/25/world/europe/summit-kim-putin-trump-nuclear-north-korea.html,"After Meeting Kim Jong-un, Putin Supports North Korea on Nuclear Disarmament",2019/04/26,world
https://www.nytimes.com/issue/todayspaper/2019/04/26/todays-new-york-times,/2019/04/25/us/politics/joe-biden-president-2020.html,5 Questions That Will Determine if Joe Biden Can Succeed,2019/04/26,us
https://www.nytimes.com/issue/todayspaper/2019/04/26/todays-new-york-times,/2019/04/25/upshot/2020-biden-bet-older-moderates.html,How Does Joe Biden Fit Into a Changing Democratic Party?,2019/04/26,upshot
https://www.nytimes.com/issue/todayspaper/2019/04/26/todays-new-york-times,/2019/04/25/world/europe/notre-dame-fire-investigation.html,Notre-Dame Fire Investigators Focus on Short-Circuit and Cigarettes,2019/04/26,world
https://www.nytimes.com/issue/todayspaper/2019/04/26/todays-new-york-times,/2019/04/25/sports/basketball/john-havlicek-dead-boston-celtics-hall-of-famer.html,"John Havlicek, a Dynamo in Two Eras of Celtics Glory, Dies at 79",2019/04/26,sports
https://www.nytimes.com/issue/todayspaper/2019/04/26/todays-new-york-times,/2019/04/25/world/asia/north-korea-otto-warmbier.html,North Korea Demanded $2 Million Before Releasing Comatose U.S. Student,2019/04/26,world
https://www.nytimes.com/issue/todayspaper/2019/04/26/todays-new-york-times,/2019/04/25/us/golden-state-killer-dna.html,Sooner or Later Your Cousin’s DNA Is Going to Solve a Murder,2019/04/26,us
https://www.nytimes.com/issue/todayspaper/2019/04/26/todays-new-york-times,/2019/04/25/us/michigan-gerrymandering.html,Judges Rule Michigan Congressional Districts Are Unconstitutionally Gerrymandered,2019/04/26,us
https://www.nytimes.com/issue/todayspaper/2019/04/26/todays-new-york-times,/2019/04/25/climate/trees-climate-change.html,Can Humans Help Trees Outrun Climate Change?,2019/04/26,climate
https://www.nytimes.com/issue/todayspaper/2019/04/26/todays-new-york-times,/2019/04/26/your-money/robocalls-spam-calls.html,Phone Companies Are Testing Tech to Catch Spam Calls. Let’s Hope It Works.,2019/04/26,
https://www.nytimes.com/issue/todayspaper/2019/04/26/todays-new-york-times,/2019/04/25/technology/uber-ipo-price-valuation.html,Uber Said to Plan I.P.O. Price Range Valuing Company as High as $90 Billion,2019/04/26,technology
https://www.nytimes.com/issue/todayspaper/2019/04/26/todays-new-york-times,/2019/04/25/world/europe/mo-farah-haile-gebrselassie-robbery.html,"Olympic Athletes’ Feud Goes Public, With Claims of Hotel Theft and Gym Attack",2019/04/26,world
https://www.nytimes.com/issue/todayspaper/2019/04/26/todays-new-york-times,/2019/04/25/sports/nfl-draft-live.html,2019 N.F.L. Draft Analysis: How All 32 Picks Fit (or Don’t Fit),2019/04/26,sports
https://www.nytimes.com/issue/todayspaper/2019/04/26/todays-new-york-times,/2019/04/25/nyregion/anna-delvey-sorokin-verdict.html,Fake Heiress Who Swindled N.Y.’s Elite Is Found Guilty,2019/04/26,nyregion
https://www.nytimes.com/issue/todayspaper/2019/04/27/todays-new-york-times,/2019/04/26/business/economy/gdp-economy.html,"Overcoming Doubts, U.S. Economy Finds a Way Forward",2019/04/27,business
https://www.nytimes.com/issue/todayspaper/2019/04/27/todays-new-york-times,/2019/04/26/us/politics/stephen-moore-donald-trump-sexual-misconduct.html,"Believing Him: For Trump, Sticking With Men Like Stephen Moore Is Nothing New",2019/04/27,us
https://www.nytimes.com/issue/todayspaper/2019/04/27/todays-new-york-times,/2019/04/26/business/nra-wayne-lapierre-oliver-north.html,Insurgents Seek to Oust Wayne LaPierre in N.R.A. Power Struggle,2019/04/27,business
https://www.nytimes.com/issue/todayspaper/2019/04/27/todays-new-york-times,/2019/04/26/us/politics/beto-o-rourke-el-paso-texas.html,The El Paso Homecoming That Set Beto O’Rourke’s Star on the Rise,2019/04/27,us
https://www.nytimes.com/issue/todayspaper/2019/04/27/todays-new-york-times,/2019/04/27/nyregion/specialized-high-schools-lobbying.html,Big Money Enters Debate Over Race and Admissions at Stuyvesant,2019/04/27,nyregion
https://www.nytimes.com/issue/todayspaper/2019/04/27/todays-new-york-times,/2019/04/26/world/asia/sri-lanka-bombing-investigation.html,Errors Raise Questions About Sri Lankan Response to Bombing,2019/04/27,world
https://www.nytimes.com/issue/todayspaper/2019/04/27/todays-new-york-times,/2019/04/26/us/politics/trump-allies.html,"As Trump Angers Allies, Rival Powers Cultivate Diplomatic Ties",2019/04/27,us
https://www.nytimes.com/issue/todayspaper/2019/04/27/todays-new-york-times,/2019/04/26/world/asia/afghanistan-saffron.html,Hashim Aslami Has Just One Word for Afghan Farmers: Saffron,2019/04/27,world
https://www.nytimes.com/issue/todayspaper/2019/04/27/todays-new-york-times,/2019/04/26/world/asia/oil-spill-rennell-mining-solomons.html,‘There’s Poison in the Sea’: An Oil Spill Fouls a Tropical Eden,2019/04/27,world
https://www.nytimes.com/issue/todayspaper/2019/04/27/todays-new-york-times,/2019/04/26/us/us-soldiers-killed-niger.html,‘I Cry Every Day’: Families of Soldiers Killed in Niger in 2017 Are Still Waiting for Answers,2019/04/27,us
https://www.nytimes.com/issue/todayspaper/2019/04/27/todays-new-york-times,/2019/04/26/us/kansas-abortion-ruling.html,"Kansas Constitution Protects Abortion Rights, State Supreme Court Rules",2019/04/27,us
https://www.nytimes.com/issue/todayspaper/2019/04/27/todays-new-york-times,/2019/04/26/nyregion/voter-registration-nyc-online.html,Public Records: Personal Information on New York City Voters Is Now Available for All to See,2019/04/27,nyregion
https://www.nytimes.com/issue/todayspaper/2019/04/27/todays-new-york-times,/2019/04/26/us/politics/trump-trade-war-wisconsin-dairy.html,"Stung by Trump’s Trade Wars, Wisconsin’s Milk Farmers Face Extinction",2019/04/27,us
https://www.nytimes.com/issue/todayspaper/2019/04/27/todays-new-york-times,/2019/04/26/your-money/notre-dame-donation-backlash-philanthropy.html,Notre-Dame Donation Backlash Raises Debate: What’s Worthy of Philanthropy?,2019/04/27,
https://www.nytimes.com/issue/todayspaper/2019/04/27/todays-new-york-times,/2019/04/26/sports/daniel-jones-giants.html,"In Jones the Giants Trust, Even if Few Others Do",2019/04/27,sports
https://www.nytimes.com/issue/todayspaper/2019/04/27/todays-new-york-times,/2019/04/26/sports/yankees-bullpen-chad-green.html,"Best Bullpen Ever? After a Month, the Yankees Aren’t Even Close",2019/04/27,sports
https://www.nytimes.com/issue/todayspaper/2019/04/28/todays-new-york-times,/2019/04/27/us/politics/guantanamo-bay-aging-terrorism-suspects-medical-care.html,Guantánamo Bay as Nursing Home: Military Envisions Hospice Care as Terrorism Suspects Age,2019/04/28,us
https://www.nytimes.com/issue/todayspaper/2019/04/28/todays-new-york-times,/interactive/2019/04/27/upshot/diversity-housing-maps-raleigh-gentrification.html,The Neighborhood Is Mostly Black. The Home Buyers Are Mostly White.,2019/04/28,upshot
https://www.nytimes.com/issue/todayspaper/2019/04/28/todays-new-york-times,/2019/04/28/us/politics/barack-obama-biden.html,Biden and Obama’s ‘Odd Couple’ Relationship Aged Into Family Ties,2019/04/28,us
https://www.nytimes.com/issue/todayspaper/2019/04/28/todays-new-york-times,/2019/04/27/world/asia/sri-lanka-attacks-wealthy.html,Two Super-Rich Families Ended Up on Opposite Sides of Easter Attacks,2019/04/28,world
https://www.nytimes.com/issue/todayspaper/2019/04/28/todays-new-york-times,/2019/04/28/health/juul-lobbying-states-ecigarettes.html,"In Washington, Juul Vows to Curb Youth Vaping. Its Lobbying in States Runs Counter to That Pledge.",2019/04/28,health
https://www.nytimes.com/issue/todayspaper/2019/04/28/todays-new-york-times,/2019/04/27/us/poway-synagogue-shooting.html,One Dead in Synagogue Shooting Near San Diego; Officials Call It Hate Crime,2019/04/28,us
https://www.nytimes.com/issue/todayspaper/2019/04/28/todays-new-york-times,/2019/04/27/world/asia/south-korea-school-grandmothers.html,"Running Out of Children, a South Korea School Enrolls Illiterate Grandmothers",2019/04/28,world
https://www.nytimes.com/issue/todayspaper/2019/04/28/todays-new-york-times,/2019/04/27/us/oliver-north-nra.html,N.R.A. President to Step Down as New York Attorney General Investigates,2019/04/28,us
https://www.nytimes.com/issue/todayspaper/2019/04/28/todays-new-york-times,/2019/04/27/us/marijuana-california-legalization.html,"‘Getting Worse, Not Better’: Illegal Pot Market Booming in California Despite Legalization",2019/04/28,us
https://www.nytimes.com/issue/todayspaper/2019/04/28/todays-new-york-times,/2019/04/26/upshot/women-long-hours-greedy-professions.html,Women Did Everything Right. Then Work Got ‘Greedy.’,2019/04/28,upshot
https://www.nytimes.com/issue/todayspaper/2019/04/29/todays-new-york-times,/2019/04/28/us/politics/william-barr-testify-congress.html,"Barr Threatens Not to Testify Before House, but Democrats May Subpoena Him",2019/04/29,us
https://www.nytimes.com/issue/todayspaper/2019/04/29/todays-new-york-times,/2019/04/28/us/politics/biden-pennsylvania-2020.html,"In Pennsylvania, Joe Biden Finds Support Where He Most Needs It",2019/04/29,us
https://www.nytimes.com/issue/todayspaper/2019/04/29/todays-new-york-times,/2019/04/28/world/asia/sri-lanka-bombing-easter-mastermind.html,Sri Lanka Attacks: Hometown of Accused Mastermind Was Fertile Ground for Extremism,2019/04/29,world
https://www.nytimes.com/issue/todayspaper/2019/04/29/todays-new-york-times,/2019/04/29/business/syrian-refugees-turkey-hazelnut-farms.html,Syrian Refugees Toil on Turkey’s Hazelnut Farms With Little to Show for It,2019/04/29,business
https://www.nytimes.com/issue/todayspaper/2019/04/29/todays-new-york-times,/2019/04/28/us/synagogue-shooting-chabad-poway.html,Synagogue Shooting Keeps Religious Leaders on Edge: ‘No One Should Be Gunned Down in Worship’,2019/04/29,us
https://www.nytimes.com/issue/todayspaper/2019/04/29/todays-new-york-times,/2019/04/28/arts/sundance-founder-abuse-arrest.html,How an Abuse Victim’s Nerve and a Hidden iPhone Led to the Arrest of a Sundance Founder,2019/04/29,arts
https://www.nytimes.com/issue/todayspaper/2019/04/29/todays-new-york-times,/2019/04/28/us/seattle-crane-collapse-accident.html,Seattle Eyes Its Crane-Filled Skyline After a Deadly Accident,2019/04/29,us
https://www.nytimes.com/issue/todayspaper/2019/04/29/todays-new-york-times,/2019/04/28/us/john-hickenlooper.html,"John Hickenlooper Thinks He Can Unite America, Bloopers and All",2019/04/29,us
https://www.nytimes.com/issue/todayspaper/2019/04/29/todays-new-york-times,/2019/04/28/world/europe/austria-grannies-against-right.html,‘It’s the Grannies!’ New Voices Rise Against Austria’s Populists,2019/04/29,world
https://www.nytimes.com/issue/todayspaper/2019/04/29/todays-new-york-times,/2019/04/28/movies/avengers-endgame-box-office.html,‘Avengers: Endgame’ Shows Movie Theaters Can Still Be on Top of the World,2019/04/29,movies
https://www.nytimes.com/issue/todayspaper/2019/04/29/todays-new-york-times,/2019/04/27/technology/apple-screen-time-trackers.html,Apple Cracks Down on Apps That Fight iPhone Addiction,2019/04/29,technology
https://www.nytimes.com/issue/todayspaper/2019/04/29/todays-new-york-times,/2019/04/29/nyregion/shelter-island-airbnb-rentals-law.html,Airbnb Backlash: Island Oasis Dreads Becoming Hamptons Hotbed,2019/04/29,nyregion
https://www.nytimes.com/issue/todayspaper/2019/04/29/todays-new-york-times,/2019/04/27/nyregion/new-york-city-record-newspaper.html,Selling Condoms or Pet Food? An Unexpected Bible of Million-Dollar Opportunities,2019/04/29,nyregion
https://www.nytimes.com/issue/todayspaper/2019/04/29/todays-new-york-times,/2019/04/28/obituaries/damon-keith-dies-at-96.html,"Damon Keith, Federal Judge Who Championed Civil Rights, Dies at 96",2019/04/29,obituaries
https://www.nytimes.com/issue/todayspaper/2019/04/29/todays-new-york-times,/2019/04/28/obituaries/senator-richard-lugar-dead.html,"Richard Lugar, G.O.P. Senator and Foreign Policy Force, Dies at 87",2019/04/29,obituaries
https://www.nytimes.com/issue/todayspaper/2019/04/29/todays-new-york-times,/2019/04/28/obituaries/damon-keith-dies-at-96.html,"Damon Keith, Federal Judge Who Championed Civil Rights, Dies at 96",2019/04/29,obituaries
