date,link,titles,news_date,category
https://www.nytimes.com/issue/todayspaper/2019/04/01/todays-new-york-times,/2019/04/01/health/sacklers-oxycontin-lawsuits.html,Lawsuits Lay Bare Sackler Family’s Role in Opioid Crisis,2019/04/01,health
https://www.nytimes.com/issue/todayspaper/2019/04/01/todays-new-york-times,/2019/03/31/us/midwest-floods-levees.html,"‘Breaches Everywhere’: Flooding Bursts Midwest Levees, and Tough Questions Follow",2019/04/01,us
https://www.nytimes.com/issue/todayspaper/2019/04/01/todays-new-york-times,/2019/03/31/nyregion/budget-new-york-congestion-pricing.html,"New York State Budget Deal Brings Congestion Pricing, Plastic Bag Ban and Mansion Tax",2019/04/01,nyregion
https://www.nytimes.com/issue/todayspaper/2019/04/01/todays-new-york-times,/2019/03/31/world/africa/russia-military-africa.html,Russia’s Military Mission Creep Advances to a New Front: Africa,2019/04/01,world
https://www.nytimes.com/issue/todayspaper/2019/04/01/todays-new-york-times,/2019/03/31/us/politics/joe-biden-flores.html,Joe Biden Scrambles to Stem Crisis After Lucy Flores’s Allegation,2019/04/01,us
https://www.nytimes.com/issue/todayspaper/2019/04/01/todays-new-york-times,/2019/03/31/sports/avenatti-nike-trump-cases.html,Michael Avenatti’s Biggest Case Yet: His Own,2019/04/01,sports
https://www.nytimes.com/issue/todayspaper/2019/04/01/todays-new-york-times,/2019/03/31/world/europe/michou-france-paris-montmartre.html,"The ‘Blue Prince of Montmartre,’ at 87, Still Rules Parisian Demimonde",2019/04/01,world
https://www.nytimes.com/issue/todayspaper/2019/04/01/todays-new-york-times,/2019/03/31/world/europe/italian-minister-pans-hit-song-by-an-immigrants-son.html,Italian Minister Pans Hit Song by an Immigrant’s Son,2019/04/01,world
https://www.nytimes.com/issue/todayspaper/2019/04/01/todays-new-york-times,/2019/03/31/us/politics/elizabeth-warren-fundraising.html,Elizabeth Warren Loses Finance Director as She Struggles in Early Fund-Raising,2019/04/01,us
https://www.nytimes.com/issue/todayspaper/2019/04/01/todays-new-york-times,/2019/03/30/us/politics/matt-gaetz-trump.html,Matt Gaetz Is a Congressman Liberals Love to Loathe. It’s All Part of the Plan.,2019/04/01,us
https://www.nytimes.com/issue/todayspaper/2019/04/01/todays-new-york-times,/2019/03/31/nyregion/karina-vetrano-trial.html,"‘Race-Biased Dragnet’: DNA From 360 Black Men Was Collected to Solve Vetrano Murder, Defense Lawyers Say",2019/04/01,nyregion
https://www.nytimes.com/issue/todayspaper/2019/04/01/todays-new-york-times,/2019/03/31/business/media/plagiarism-music-songwriters.html,"‘Blurred Lines’ on Their Minds, Songwriters Create Nervously",2019/04/01,business
https://www.nytimes.com/issue/todayspaper/2019/04/01/todays-new-york-times,/2019/03/31/business/law-firms-brexit.html,Brexit Is Messy. London’s Lawyers Are Cashing In.,2019/04/01,business
https://www.nytimes.com/issue/todayspaper/2019/04/01/todays-new-york-times,/2019/03/31/obituaries/kenneth-a-gibson-dead-at-86.html,"Kenneth Gibson, 86, Dies; Newark Mayor Broke Race Barrier in Northeast",2019/04/01,obituaries
https://www.nytimes.com/issue/todayspaper/2019/04/01/todays-new-york-times,/2019/03/31/arts/television/twilight-zone-review.html,Review: A ‘Twilight Zone’ Trying to Find Its Dimension,2019/04/01,arts
https://www.nytimes.com/issue/todayspaper/2019/04/01/todays-new-york-times,/2019/03/31/sports/duke-michigan-state-ncaa-tournament.html,Michigan State Heads to Final Four After Banding Together to Shock Duke,2019/04/01,sports
https://www.nytimes.com/issue/todayspaper/2019/04/01/todays-new-york-times,/2019/03/31/sports/kentucky-auburn-ncaa-tournament.html,Auburn Makes Its First Final Four by Beating Kentucky,2019/04/01,sports
https://www.nytimes.com/issue/todayspaper/2019/04/02/todays-new-york-times,/2019/04/01/business/british-business-brexit.html,"For Many British Businesses, Brexit Has Already Happened",2019/04/02,business
https://www.nytimes.com/issue/todayspaper/2019/04/02/todays-new-york-times,/2019/04/01/world/europe/turkey-erdogan-election-loss.html,A Political Quake in Turkey as Erdogan’s Party Loses in His Home Base of Support,2019/04/02,world
https://www.nytimes.com/issue/todayspaper/2019/04/02/todays-new-york-times,/2019/04/01/us/politics/trump-security-clearances.html,White House Whistle-Blower Tells Congress of Irregularities in Security Clearances,2019/04/02,us
https://www.nytimes.com/issue/todayspaper/2019/04/02/todays-new-york-times,/2019/04/01/world/americas/mexico-migration-border.html,"Migration Surge From Central America Was Spurred, in Part, by Mexican Policies",2019/04/02,world
https://www.nytimes.com/issue/todayspaper/2019/04/02/todays-new-york-times,/2019/04/01/technology/india-elections-facebook.html,"In India Election, False Posts and Hate Speech Flummox Facebook",2019/04/02,technology
https://www.nytimes.com/issue/todayspaper/2019/04/02/todays-new-york-times,/2019/04/01/nyregion/new-york-congestion-pricing.html,Congestion Pricing: N.Y. Embraced It. Will Other Clogged Cities Follow?,2019/04/02,nyregion
https://www.nytimes.com/issue/todayspaper/2019/04/02/todays-new-york-times,/2019/04/01/world/canada/china-dissident-harassment-sheng-xue.html,Chinese Dissidents Feel Heat of Beijing’s Wrath. Even in Canada.,2019/04/02,world
https://www.nytimes.com/issue/todayspaper/2019/04/02/todays-new-york-times,/2019/04/01/world/europe/uk-parliament-soft-brexit-may.html,U.K. Parliament Votes Down Alternative Brexit Deals,2019/04/02,world
https://www.nytimes.com/issue/todayspaper/2019/04/02/todays-new-york-times,/2019/04/01/us/politics/puerto-rico-aid.html,Impasse Over Aid for Puerto Rico Stalls Billions in Federal Disaster Relief,2019/04/02,us
https://www.nytimes.com/issue/todayspaper/2019/04/02/todays-new-york-times,/2019/04/01/us/beatrice-six-nebraska.html,A Rural County Owes $28 Million for Wrongful Convictions. It Doesn’t Want to Pay.,2019/04/02,us
https://www.nytimes.com/issue/todayspaper/2019/04/02/todays-new-york-times,/2019/04/01/us/politics/joe-biden-amy-lappos.html,A Second Woman Says Biden’s Touching Made Her Uncomfortable,2019/04/02,us
https://www.nytimes.com/issue/todayspaper/2019/04/02/todays-new-york-times,/2019/04/01/us/politics/trump-putin-venezuela-red-line.html,"Trump, Putin and a Possible ‘Red-Line Moment’ in Venezuela",2019/04/02,us
https://www.nytimes.com/issue/todayspaper/2019/04/02/todays-new-york-times,/2019/04/01/world/africa/algeria-bouteflika-resign.html,"Algeria’s Ruler, Abdelaziz Bouteflika, Agrees to Resign",2019/04/02,world
https://www.nytimes.com/issue/todayspaper/2019/04/02/todays-new-york-times,/2019/04/02/nyregion/suny-new-paltz-slave-owners.html,Slave Owners’ Names Are on Dorms at a SUNY School. That’s Changing.,2019/04/02,nyregion
https://www.nytimes.com/issue/todayspaper/2019/04/02/todays-new-york-times,/2019/04/01/us/politics/us-china-trade-trump.html,China Purchases Could Undercut Trump’s Larger Trade Goal,2019/04/02,us
https://www.nytimes.com/issue/todayspaper/2019/04/02/todays-new-york-times,/2019/04/01/technology/burger-king-impossible-whopper.html,Behold the Beefless ‘Impossible Whopper’,2019/04/02,technology
https://www.nytimes.com/issue/todayspaper/2019/04/02/todays-new-york-times,/2019/04/01/arts/television/jane-the-virgin-crazy-ex-girlfriend-final-season.html,"As ‘Jane the Virgin’ and ‘Crazy Ex-Girlfriend’ End, Two Groundbreaking TV Characters Say Goodbye",2019/04/02,arts
https://www.nytimes.com/issue/todayspaper/2019/04/02/todays-new-york-times,/2019/04/01/sports/santa-anita-horse-deaths.html,Death of Another Horse at Santa Anita Rocks the Racing Industry,2019/04/02,sports
https://www.nytimes.com/issue/todayspaper/2019/04/03/todays-new-york-times,/2019/04/02/us/politics/obamacare-donald-trump.html,Trump Retreats on Health Care After McConnell Warns It Won’t Happen,2019/04/03,us
https://www.nytimes.com/issue/todayspaper/2019/04/03/todays-new-york-times,/2019/04/02/world/europe/theresa-may-labour-brexit.html,Theresa May Will Reach Out to Corbyn in Bid to Avoid Disorderly Brexit,2019/04/03,world
https://www.nytimes.com/issue/todayspaper/2019/04/03/todays-new-york-times,/2019/04/02/us/arctic-oil-drilling-well-data.html,A Key to the Arctic’s Oil Riches Lies Hidden in Ohio,2019/04/03,us
https://www.nytimes.com/issue/todayspaper/2019/04/03/todays-new-york-times,/2019/04/02/us/politics/joe-biden-women-me-too.html,Biden’s Tactile Politics Threaten His Return in the #MeToo Era,2019/04/03,us
https://www.nytimes.com/issue/todayspaper/2019/04/03/todays-new-york-times,/2019/04/02/us/chicago-election-results.html,"Lori Lightfoot Is Elected Chicago Mayor, Becoming First Black Woman to Lead City",2019/04/03,us
https://www.nytimes.com/issue/todayspaper/2019/04/03/todays-new-york-times,/2019/04/02/us/virginia-scandal-northam-fairfax.html,‘It Just Went Poof’: The Strange Aftermath of Virginia’s Cascade of Political Scandals,2019/04/03,us
https://www.nytimes.com/issue/todayspaper/2019/04/03/todays-new-york-times,/2019/04/02/technology/for-him-for-hers-get-roman.html,Drug Sites Upend Doctor-Patient Relations: ‘It’s Restaurant-Menu Medicine’,2019/04/03,technology
https://www.nytimes.com/issue/todayspaper/2019/04/03/todays-new-york-times,/2019/04/02/world/asia/boeing-max-8-lion-air.html,"Between Two Boeing Crashes, Days of Silence and Mistrust",2019/04/03,world
https://www.nytimes.com/issue/todayspaper/2019/04/03/todays-new-york-times,/2019/04/02/nyregion/mta-cuomo-congestion-pricing.html,Cuomo Promised Transparency at the M.T.A. Then Its Leader Was Confirmed While You Slept.,2019/04/03,nyregion
https://www.nytimes.com/issue/todayspaper/2019/04/03/todays-new-york-times,/2019/04/02/nyregion/bowery-savings-bank-records.html,Spared From the Shredder (for Now): ‘Priceless’ Bank Records of Old New York,2019/04/03,nyregion
https://www.nytimes.com/issue/todayspaper/2019/04/03/todays-new-york-times,/2019/04/02/business/media/media-companies-take-a-big-gamble-on-apple.html,Media Companies Take a Big Gamble on Apple,2019/04/03,business
https://www.nytimes.com/issue/todayspaper/2019/04/03/todays-new-york-times,/2019/04/03/business/economy/japan-economy-china-abenomics.html,Japan Stumbles as China’s Growth Engine Slows,2019/04/03,business
https://www.nytimes.com/issue/todayspaper/2019/04/03/todays-new-york-times,/2019/04/02/us/mar-a-lago-zhang-chinese-secret-service.html,Woman From China Carrying Malware Arrested After Entering Mar-a-Lago,2019/04/03,us
https://www.nytimes.com/issue/todayspaper/2019/04/03/todays-new-york-times,/2019/04/02/us/trump-puerto-rico.html,"Trump Lashes Out Again at Puerto Rico, Bewildering the Island",2019/04/03,us
https://www.nytimes.com/issue/todayspaper/2019/04/03/todays-new-york-times,/2019/04/02/us/bald-eagles-trash-seattle.html,"Bald Eagles, Symbol of America, Are Dumping Trash on the Seattle Suburbs",2019/04/03,us
https://www.nytimes.com/issue/todayspaper/2019/04/03/todays-new-york-times,/2019/04/01/arts/television/hannah-gadsby-australia.html,Hannah Gadsby on Autism and the Risk of Failing After ‘Nanette’,2019/04/03,arts
https://www.nytimes.com/issue/todayspaper/2019/04/03/todays-new-york-times,/2019/04/02/dining/catering-new-york-city-hotbox-lee-brothers.html,"Undercover and Overworked: Inside the New, Nerve-Racking World of Catering",2019/04/03,dining
https://www.nytimes.com/issue/todayspaper/2019/04/03/todays-new-york-times,/2019/04/02/dining/standard-grill-review.html,"The TV Chef Rocco DiSpirito Returns, With a Quieter Touch",2019/04/03,dining
https://www.nytimes.com/issue/todayspaper/2019/04/03/todays-new-york-times,/2019/04/02/sports/yankees-injuries-miguel-andujar.html,An Early Crush of Injuries Tests the Yankees’ Spring Optimism,2019/04/03,sports
https://www.nytimes.com/issue/todayspaper/2019/04/04/todays-new-york-times,/2019/04/03/us/politics/william-barr-mueller-report.html,Some on Mueller’s Team Say Report Was More Damaging Than Barr Revealed,2019/04/04,us
https://www.nytimes.com/issue/todayspaper/2019/04/04/todays-new-york-times,/2019/04/03/health/measles-outbreaks-ukraine-israel.html,Scientists Thought They Had Measles Cornered. They Were Wrong.,2019/04/04,health
https://www.nytimes.com/issue/todayspaper/2019/04/04/todays-new-york-times,/2019/04/03/us/politics/mar-a-lago-chinese-malware.html,Malware Arrest Exposes Security Gaps at Trump’s Mar-a-Lago Club,2019/04/04,us
https://www.nytimes.com/issue/todayspaper/2019/04/04/todays-new-york-times,/2019/04/03/us/alabama-prisons-doj-investigation.html,Alabama’s Gruesome Prisons: Report Finds Rape and Murder at All Hours,2019/04/04,us
https://www.nytimes.com/issue/todayspaper/2019/04/04/todays-new-york-times,/2019/04/03/us/politics/trump-republican-party.html,Trump’s Takeover of the Republican Party Is Almost Complete,2019/04/04,us
https://www.nytimes.com/issue/todayspaper/2019/04/04/todays-new-york-times,/2019/04/03/us/politics/joe-biden-women-video.html,"Joe Biden, in Video, Says He Will Be ‘More Mindful’ of Personal Space",2019/04/04,us
https://www.nytimes.com/issue/todayspaper/2019/04/04/todays-new-york-times,/2019/04/03/us/felicity-huffman-lori-loughlin-college-admissions-scandal.html,Felicity Huffman and Lori Loughlin Appear in Court as College Admissions Scandal Rewrites Lives,2019/04/04,us
https://www.nytimes.com/issue/todayspaper/2019/04/04/todays-new-york-times,/2019/04/03/us/lori-lightfoot-chicago.html,Lori Lightfoot Promised Change as Chicago Mayor. Now Comes the Hard Part.,2019/04/04,us
https://www.nytimes.com/issue/todayspaper/2019/04/04/todays-new-york-times,/2019/04/03/world/middleeast/sisi-egypt-soap-opera.html,Egypt’s Soap Opera Clampdown Extends el-Sisi’s Iron Grip to TV,2019/04/04,world
https://www.nytimes.com/issue/todayspaper/2019/04/04/todays-new-york-times,/2019/04/03/world/europe/theresa-may-jeremy-corbyn-brexit.html,Theresa May and Jeremy Corbyn Open Treacherous Brexit Negotiation,2019/04/04,world
https://www.nytimes.com/issue/todayspaper/2019/04/04/todays-new-york-times,/2019/04/03/nyregion/trump-twitter-block-lawsuit.html,"If Trump Can Legally Block Critics on Twitter, Your Local Politician May Do It, Too",2019/04/04,nyregion
https://www.nytimes.com/issue/todayspaper/2019/04/04/todays-new-york-times,/2019/04/03/business/economy/immigration-labor-economy.html,"Short of Workers, U.S. Builders and Farmers Crave More Immigrants",2019/04/04,business
https://www.nytimes.com/issue/todayspaper/2019/04/04/todays-new-york-times,/2019/04/03/business/media/accenture-droga5-advertising.html,"Accenture Is Buying Droga5, an Ad Agency, Making a Bet on Creativity",2019/04/04,business
https://www.nytimes.com/issue/todayspaper/2019/04/04/todays-new-york-times,/2019/04/04/sports/unc-scandal.html,College Sports 101: A U.N.C. Class Reviews a Scandal at Its Source,2019/04/04,sports
https://www.nytimes.com/issue/todayspaper/2019/04/04/todays-new-york-times,/2019/04/03/theater/katrina-lenk-the-bands-visit.html,"Goodbye, Omar Sharif: Katrina Lenk Reflects on ‘The Band’s Visit’",2019/04/04,theater
https://www.nytimes.com/issue/todayspaper/2019/04/04/todays-new-york-times,/2019/04/03/arts/television/killing-eve-phoebe-waller-bridge-jodie-comer.html,The Wild Inspirations for ‘Killing Eve’,2019/04/04,arts
https://www.nytimes.com/issue/todayspaper/2019/04/04/todays-new-york-times,/2019/04/01/style/sam-rockwell.html,"Sam Rockwell, Screendom’s Slinkiest Rogue",2019/04/04,style
https://www.nytimes.com/issue/todayspaper/2019/04/05/todays-new-york-times,/2019/04/04/business/boeing-737-ethiopian-airlines.html,Ethiopian Crash Report Indicates Pilots Followed Boeing’s Emergency Procedures,2019/04/05,business
https://www.nytimes.com/issue/todayspaper/2019/04/05/todays-new-york-times,/2019/04/04/business/herman-cain-federal-reserve.html,"Trump Says He Wants Herman Cain, Former Pizza Executive, for Fed Board",2019/04/05,business
https://www.nytimes.com/issue/todayspaper/2019/04/05/todays-new-york-times,/2019/04/04/world/europe/antisemitism-europe-united-states.html,"Anti-Semitism Is Back, From the Left, Right and Islamist Extremes. Why?",2019/04/05,world
https://www.nytimes.com/issue/todayspaper/2019/04/05/todays-new-york-times,/2019/04/04/us/politics/trump-biden-tweet.html,"Finding Biden in Familiar Fix, President Trump Adds a Jab",2019/04/05,us
https://www.nytimes.com/issue/todayspaper/2019/04/05/todays-new-york-times,/2019/04/04/us/lds-church-lgbt.html,Mormon Church to Allow Children of L.G.B.T. Parents to Be Baptized,2019/04/05,us
https://www.nytimes.com/issue/todayspaper/2019/04/05/todays-new-york-times,/2019/04/04/arts/music/nipsey-hussle-shooting-death.html,"For Nipsey Hussle and Rap’s Thriving Middle Class, Staying Close to Home Can Have a Price",2019/04/05,arts
https://www.nytimes.com/issue/todayspaper/2019/04/05/todays-new-york-times,/2019/04/04/arts/design/guide-the-shed-hudson-yards.html,The Shed Is Finally Open. Here’s What You Need to Know.,2019/04/05,arts
https://www.nytimes.com/issue/todayspaper/2019/04/05/todays-new-york-times,/interactive/2019/03/31/us/politics/trump-investigations-that-grew-out-of-mueller.html,The Criminal Investigations That Sprouted From Mueller,2019/04/05,us
https://www.nytimes.com/issue/todayspaper/2019/04/05/todays-new-york-times,/2019/04/04/us/politics/wisconsin-2020.html,"Wisconsin, Ground Zero for 2020 Politics, Looks Like a Tossup Again",2019/04/05,us
https://www.nytimes.com/issue/todayspaper/2019/04/05/todays-new-york-times,/2019/04/04/business/economy/trump-xi-china-trade-meeting.html,"‘Epic’ China Trade Deal Near Completion, Trump Says, but Haggling Continues",2019/04/05,business
https://www.nytimes.com/issue/todayspaper/2019/04/05/todays-new-york-times,/2019/04/04/world/africa/libya-tripoli-militia-hifter.html,"In Libya, Militia Advances on Capital, Raising Prospect of Renewed Civil War",2019/04/05,world
https://www.nytimes.com/issue/todayspaper/2019/04/05/todays-new-york-times,/2019/04/04/us/politics/nato-anniversary.html,"As NATO Envoys Celebrate, Signs of Fracturing From Within",2019/04/05,us
https://www.nytimes.com/issue/todayspaper/2019/04/05/todays-new-york-times,/2019/04/04/health/memorial-sloan-kettering-conflicts-.html,"Memorial Sloan Kettering Leaders Violated Conflict-of-Interest Rules, Report Finds",2019/04/05,health
https://www.nytimes.com/issue/todayspaper/2019/04/05/todays-new-york-times,/2019/04/04/nyregion/de-blasio-2020-fundraiser.html,De Blasio Wouldn’t Say Who Was Hosting His Boston Fund-Raiser. We Found Out.,2019/04/05,nyregion
https://www.nytimes.com/issue/todayspaper/2019/04/05/todays-new-york-times,/2019/04/04/nyregion/homeless-buildings-sold-de-blasio-democrats.html,Landlords Get a $173 Million Deal From City as Their Lawyer Raises Funds for de Blasio,2019/04/05,nyregion
https://www.nytimes.com/issue/todayspaper/2019/04/05/todays-new-york-times,/2019/04/04/sports/notre-dame-uconn-final-four-arike-ogunbowale.html,"Arike Ogunbowale Strives for Greater Fame. But First, Another Title.",2019/04/05,sports
https://www.nytimes.com/issue/todayspaper/2019/04/05/todays-new-york-times,/2019/04/04/business/economy-manufacturing-jobs-trump.html,"Manufacturing Surge, a Boon for Trump, May Be Fading",2019/04/05,business
https://www.nytimes.com/issue/todayspaper/2019/04/05/todays-new-york-times,/interactive/2019/04/02/climate/pricing-carbon-emissions.html,These Countries Have Prices on Carbon. Are They Working?,2019/04/05,climate
https://www.nytimes.com/issue/todayspaper/2019/04/05/todays-new-york-times,/2019/04/04/theater/king-lear-review-glenda-jackson.html,Review: Glenda Jackson Rules a Muddled World in ‘King Lear’,2019/04/05,theater
https://www.nytimes.com/issue/todayspaper/2019/04/06/todays-new-york-times,/2019/04/05/business/economy/trump-fed-interest-rates.html,Trump Says Fed Should Cut Rates and Lift Economy,2019/04/06,business
https://www.nytimes.com/issue/todayspaper/2019/04/06/todays-new-york-times,/2019/04/05/us/politics/guantanamo-trials-torture.html,Guantánamo Trials Grapple With How Much Evidence to Allow About Torture,2019/04/06,us
https://www.nytimes.com/issue/todayspaper/2019/04/06/todays-new-york-times,/2019/04/05/us/politics/trump-tax-returns.html,Trump Lawyer Asserts President’s Right to Keep Tax Returns Private,2019/04/06,us
https://www.nytimes.com/issue/todayspaper/2019/04/06/todays-new-york-times,/interactive/2019/04/03/world/white-extremist-terrorism-christchurch.html,Attacks by White Extremists Are Growing. So Are Their Connections.,2019/04/06,world
https://www.nytimes.com/issue/todayspaper/2019/04/06/todays-new-york-times,/2019/04/05/business/china-trade-trump-jobs-decoupling.html,One Trump Victory: Companies Rethink China,2019/04/06,business
https://www.nytimes.com/issue/todayspaper/2019/04/06/todays-new-york-times,/2019/04/05/business/media/lil-nas-x-billy-ray-cyrus-billboard.html,Lil Nas X Added Billy Ray Cyrus to ‘Old Town Road.’ Is It Country Enough for Billboard Now?,2019/04/06,business
https://www.nytimes.com/issue/todayspaper/2019/04/06/todays-new-york-times,/2019/04/05/health/military-mindfulness-training.html,The Latest in Military Strategy: Mindfulness,2019/04/06,health
https://www.nytimes.com/issue/todayspaper/2019/04/06/todays-new-york-times,/2019/04/06/world/africa/rwanda-genocide-25-years.html,Rwanda Marks 25 Years Since the Genocide. The Country Is Still Grappling With Its Legacy.,2019/04/06,world
https://www.nytimes.com/issue/todayspaper/2019/04/06/todays-new-york-times,/2019/04/05/world/americas/us-mexico-border-delays.html,‘Catastrophic’ Delays at U.S.-Mexico Border Follow Redeployment of Agents,2019/04/06,world
https://www.nytimes.com/issue/todayspaper/2019/04/06/todays-new-york-times,/2019/04/05/business/herman-cain-federal-reserve.html,Herman Cain Opens a New #MeToo Minefield for Republicans,2019/04/06,business
https://www.nytimes.com/issue/todayspaper/2019/04/06/todays-new-york-times,/2019/04/05/us/politics/joe-biden-controversy.html,"Joe Biden Jokes About Hugging in a Speech, Then Offers a Mixed Apology",2019/04/06,us
https://www.nytimes.com/issue/todayspaper/2019/04/06/todays-new-york-times,/2019/04/05/business/boeing-737-production.html,Boeing to Cut Production of 737 Max After 2 Fatal Crashes,2019/04/06,business
https://www.nytimes.com/issue/todayspaper/2019/04/06/todays-new-york-times,/2019/04/05/your-money/mark-begor-equifax-ceo-interview.html,The New Equifax Boss Wants to Make Amends. We Have Some Questions.,2019/04/06,
https://www.nytimes.com/issue/todayspaper/2019/04/06/todays-new-york-times,/2019/04/06/nyregion/rocky-chuck-wepner-muhammad-ali.html,‘Rocky’ Has a Statue in Philadelphia. Now the ‘Real Rocky’ Will Get One in Jersey.,2019/04/06,nyregion
https://www.nytimes.com/issue/todayspaper/2019/04/06/todays-new-york-times,/2019/04/05/arts/music/kurt-cobain-nirvana-death.html,"Kurt Cobain: What to Read and Watch, 25 Years After the Nirvana Leader’s Death",2019/04/06,arts
https://www.nytimes.com/issue/todayspaper/2019/04/06/todays-new-york-times,/2019/04/06/sports/final-four-auburn-virginia-bruce-pearl.html,Bruce Pearl at Auburn: Rebirth of a Salesman,2019/04/06,sports
https://www.nytimes.com/issue/todayspaper/2019/04/06/todays-new-york-times,/2019/04/05/obituaries/dan-robbins-dead.html,"Dan Robbins, Who Made Painting as Easy as 1-2-3 (and 4-5-6), Dies at 93",2019/04/06,obituaries
https://www.nytimes.com/issue/todayspaper/2019/04/06/todays-new-york-times,/2019/04/05/obituaries/sydney-brenner-dead.html,"Sydney Brenner, a Decipherer of the Genetic Code, Is Dead at 92",2019/04/06,obituaries
https://www.nytimes.com/issue/todayspaper/2019/04/07/todays-new-york-times,/2019/04/06/health/drug-resistant-candida-auris.html,"A Mysterious Infection, Spanning the Globe in a Climate of Secrecy",2019/04/07,health
https://www.nytimes.com/issue/todayspaper/2019/04/07/todays-new-york-times,/2019/04/06/world/americas/brazil-soccer-fire.html,Fiery Deaths of 10 Boys Exposes Brutality of Brazil’s Soccer Mills,2019/04/07,world
https://www.nytimes.com/issue/todayspaper/2019/04/07/todays-new-york-times,/2019/04/06/upshot/fed-moore-cain-risk-partisanship.html,What’s at Risk if the Fed Becomes as Partisan as the Rest of Washington,2019/04/07,upshot
https://www.nytimes.com/issue/todayspaper/2019/04/07/todays-new-york-times,/2019/04/06/us/politics/biden-2020.html,Biden Didn’t Rush Into 2020. The Race Came to Him Anyway.,2019/04/07,us
https://www.nytimes.com/issue/todayspaper/2019/04/07/todays-new-york-times,/2019/04/07/us/trash-pickers-san-francisco-zuckerberg.html,"In San Francisco, Making a Living From Your Billionaire Neighbor’s Trash",2019/04/07,us
https://www.nytimes.com/issue/todayspaper/2019/04/07/todays-new-york-times,/2019/04/06/world/europe/france-china-wine.html,"As Chinese Buy French Vineyards, Names Like Château Imperial Rabbit Rattle Purists",2019/04/07,world
https://www.nytimes.com/issue/todayspaper/2019/04/07/todays-new-york-times,/2019/04/05/us/boeing-seattle.html,"‘They Will Bounce Back’: In Seattle, Where the Boeing Max Is Built, They’ve Recovered Before",2019/04/07,us
https://www.nytimes.com/issue/todayspaper/2019/04/07/todays-new-york-times,/2019/04/06/obituaries/ernest-hollings-dead.html,"Ernest Hollings, 97, a South Carolina Senator Who Evolved, Is Dead",2019/04/07,obituaries
https://www.nytimes.com/issue/todayspaper/2019/04/07/todays-new-york-times,/2019/04/06/sports/ncaa-final-four-virginia-auburn.html,"N.C.A.A. Final Four: A Shot, a Whistle and a First Final for Virginia",2019/04/07,sports
https://www.nytimes.com/issue/todayspaper/2019/04/07/todays-new-york-times,/2019/04/06/sports/ncaa-final-four-michigan-state-texas-tech.html,N.C.A.A. Final Four: Texas Tech Upsets Michigan State,2019/04/07,sports
https://www.nytimes.com/issue/todayspaper/2019/04/08/todays-new-york-times,/2019/04/07/us/politics/kirstjen-nielsen-dhs-resigns.html,Kirstjen Nielsen Resigns as Trump’s Homeland Security Secretary,2019/04/08,us
