date,link,titles,news_date,category
https://www.nytimes.com/issue/todayspaper/2019/05/14/todays-new-york-times,/2019/05/13/world/europe/cumbria-uk-austerity-cuts.html,‘This Is All We Can Afford’: Shrinking Lives in the English Countryside,2019/05/14,world
https://www.nytimes.com/issue/todayspaper/2019/05/14/todays-new-york-times,/2019/05/13/world/middleeast/us-military-plans-iran.html,"White House Reviews Military Plans Against Iran, in Echoes of Iraq War",2019/05/14,world
https://www.nytimes.com/issue/todayspaper/2019/05/14/todays-new-york-times,/2019/05/13/obituaries/doris-day-death.html,"Doris Day, Movie Star Who Charmed America, Dies at 97",2019/05/14,obituaries
https://www.nytimes.com/issue/todayspaper/2019/05/14/todays-new-york-times,/2019/05/13/us/politics/supreme-court-antitrust-apple.html,Supreme Court Allows Antitrust Lawsuit Against Apple to Proceed,2019/05/14,us
https://www.nytimes.com/issue/todayspaper/2019/05/14/todays-new-york-times,/2019/05/13/business/toys-phones-and-sneakers-the-chinese-goods-trump-wants-to-tax-next.html,"Toys, Phones and Sneakers: The Chinese Goods Trump Wants to Tax Next",2019/05/14,business
https://www.nytimes.com/issue/todayspaper/2019/05/14/todays-new-york-times,/2019/05/13/world/middleeast/saudi-arabia-oil-tanker-sabotage.html,Claim of Attacks on 4 Oil Vessels Raises Tensions in Middle East,2019/05/14,world
https://www.nytimes.com/issue/todayspaper/2019/05/14/todays-new-york-times,/2019/05/13/world/asia/sri-lanka-curfew-mobs.html,Sri Lanka Declares Curfew After Mobs Target Muslims,2019/05/14,world
https://www.nytimes.com/issue/todayspaper/2019/05/14/todays-new-york-times,/2019/05/13/us/politics/trump-viktor-orban-oval-office.html,"Viktor Orban, Hungary’s Far-Right Leader, Gets Warm Welcome From Trump",2019/05/14,us
https://www.nytimes.com/issue/todayspaper/2019/05/14/todays-new-york-times,/interactive/2019/05/11/us/school-shootings-united-states.html,"A Half-Century of School Shootings Like Columbine, Sandy Hook and Parkland",2019/05/14,us
https://www.nytimes.com/issue/todayspaper/2019/05/14/todays-new-york-times,/2019/05/13/us/politics/donald-trump-jr-subpoena.html,"Donald Trump Jr.’s No-Shows Led to Subpoena, Republican Senator Says",2019/05/14,us
https://www.nytimes.com/issue/todayspaper/2019/05/14/todays-new-york-times,/2019/05/13/business/fusion-energy-climate-change.html,The Fusion Reactor Next Door,2019/05/14,business
https://www.nytimes.com/issue/todayspaper/2019/05/14/todays-new-york-times,/2019/05/13/arts/music/nancy-and-beth-megan-mullally-stephanie-hunt.html,Megan Mullally and Stephanie Hunt’s Choreographed Antics Are Giving Cabaret a Jolt,2019/05/14,arts
https://www.nytimes.com/issue/todayspaper/2019/05/14/todays-new-york-times,/2019/05/13/arts/best-things-to-see-venice-biennale.html,The Don’t-Miss Shows and Pavilions at the Venice Biennale,2019/05/14,arts
https://www.nytimes.com/issue/todayspaper/2019/05/14/todays-new-york-times,/2019/05/13/nyregion/marijuana-legalization-ny-nj.html,"Marijuana Legalization Hits a Wall: First in New Jersey, Then in New York",2019/05/14,nyregion
https://www.nytimes.com/issue/todayspaper/2019/05/14/todays-new-york-times,/2019/05/13/nyregion/eric-garner-death-daniel-pantaleo-trial-chokehold.html,Police Investigators Determined Officer Choked Eric Garner,2019/05/14,nyregion
https://www.nytimes.com/issue/todayspaper/2019/05/15/todays-new-york-times,/2019/05/14/us/politics/trump-tariffs-china.html,"Trump’s Tariffs, Once Seen as Leverage, May Be Here to Stay",2019/05/15,us
https://www.nytimes.com/issue/todayspaper/2019/05/15/todays-new-york-times,/2019/05/14/business/us-china-tariffs.html,"In China, Some Fear the End of ‘Chimerica’",2019/05/15,business
https://www.nytimes.com/issue/todayspaper/2019/05/15/todays-new-york-times,/2019/05/14/us/nra-finances-executives-board-members.html,"At the N.R.A., a Cash Machine Sputtering",2019/05/15,us
https://www.nytimes.com/issue/todayspaper/2019/05/15/todays-new-york-times,/2019/05/14/world/middleeast/trump-iran-threats.html,Skeptical U.S. Allies Resist Trump’s New Claims of Threats From Iran,2019/05/15,world
https://www.nytimes.com/issue/todayspaper/2019/05/15/todays-new-york-times,/2019/05/14/us/facial-recognition-ban-san-francisco.html,San Francisco Bans Facial Recognition Technology,2019/05/15,us
https://www.nytimes.com/issue/todayspaper/2019/05/15/todays-new-york-times,/2019/05/14/world/europe/orban-hungary-antisemitism.html,"A Friend to Israel, and to Bigots: Viktor Orban’s ‘Double Game’ on Anti-Semitism",2019/05/15,world
https://www.nytimes.com/issue/todayspaper/2019/05/15/todays-new-york-times,/2019/05/14/world/europe/pompeo-lavrov-russia-iran.html,"U.S.-Russia Talks Expose Deep Fissures, Despite Hopes for Better Ties",2019/05/15,world
https://www.nytimes.com/issue/todayspaper/2019/05/15/todays-new-york-times,/2019/05/14/world/middleeast/eurovision-israel-tel-aviv.html,"Eurovision Arrives in Tel Aviv, in Range of Rockets and the Focus of Protests",2019/05/15,world
https://www.nytimes.com/issue/todayspaper/2019/05/15/todays-new-york-times,/2019/05/14/nyregion/measles-vaccine-orthodox-jews.html,"Despite Measles Warnings, Anti-Vaccine Rally Draws Hundreds of Ultra-Orthodox Jews",2019/05/15,nyregion
https://www.nytimes.com/issue/todayspaper/2019/05/15/todays-new-york-times,/2019/05/14/nyregion/anthony-weiner-prison-release.html,Anthony Weiner Released From Prison After Serving 18 Months for Sexting Teenager,2019/05/15,nyregion
https://www.nytimes.com/issue/todayspaper/2019/05/15/todays-new-york-times,/2019/05/14/business/india-modi-business-red-tape.html,Modi Cut India’s Red Tape. Now He Hopes to Win Votes for His Work.,2019/05/15,business
https://www.nytimes.com/issue/todayspaper/2019/05/15/todays-new-york-times,/2019/05/14/us/appalachian-trail-murder.html,"Hikers Take to the Appalachian Trail to Escape the Real World. This Time, They Couldn’t.",2019/05/15,us
https://www.nytimes.com/issue/todayspaper/2019/05/15/todays-new-york-times,/2019/05/14/us/politics/donald-trump-jr-intelligence-committee.html,Donald Trump Jr. Strikes Deal for ‘Limited’ Interview With Intelligence Committee,2019/05/15,us
https://www.nytimes.com/issue/todayspaper/2019/05/15/todays-new-york-times,/2019/05/14/sports/zion-pelicans-nba-lottery.html,"N.B.A. Draft Lottery Recap: Pelicans Win No. 1 Pick, and the Right to Select Zion Williamson",2019/05/15,sports
https://www.nytimes.com/issue/todayspaper/2019/05/15/todays-new-york-times,/2019/05/14/obituaries/tim-conway-dead.html,"Tim Conway, Beloved TV Bumbler, Is Dead at 85",2019/05/15,obituaries
https://www.nytimes.com/issue/todayspaper/2019/05/15/todays-new-york-times,/2019/05/15/sports/yankees-minor-leagues.html,"For These Minor Leaguers, the Living Is Good if You Don’t Mind the Dead Below",2019/05/15,sports
https://www.nytimes.com/issue/todayspaper/2019/05/16/todays-new-york-times,/2019/05/15/world/middleeast/iran-war-usa.html,Iran Threat Debate Is Set Off by Images of Missiles at Sea,2019/05/16,world
https://www.nytimes.com/issue/todayspaper/2019/05/16/todays-new-york-times,/2019/05/15/us/politics/trump-immigration-kushner.html,Trump Immigration Proposal Emphasizes Immigrants’ Skills Over Family Ties,2019/05/16,us
https://www.nytimes.com/issue/todayspaper/2019/05/16/todays-new-york-times,/2019/05/15/arts/design/met-museum-sackler-opioids.html,The Met Will Turn Down Sackler Money Amid Fury Over the Opioid Crisis,2019/05/16,arts
https://www.nytimes.com/issue/todayspaper/2019/05/16/todays-new-york-times,/2019/05/15/us/politics/supreme-court-abortion.html,"Alabama Aims Squarely at Roe, but the Supreme Court May Prefer Glancing Blows",2019/05/16,us
https://www.nytimes.com/issue/todayspaper/2019/05/16/todays-new-york-times,/2019/05/15/nyregion/fur-ban-nyc-sales.html,Proposed Fur Ban in New York Pits Animal Rights Advocates Against Black Ministers,2019/05/16,nyregion
https://www.nytimes.com/issue/todayspaper/2019/05/16/todays-new-york-times,/2019/05/15/us/politics/china-trade-donald-trump.html,Trump’s Love for Tariffs Began in Japan’s ’80s Boom,2019/05/16,us
https://www.nytimes.com/issue/todayspaper/2019/05/16/todays-new-york-times,/2019/05/15/us/abortion-laws-2019.html,"‘The Time Is Now’: States Are Rushing to Restrict Abortion, or to Protect It",2019/05/16,us
https://www.nytimes.com/issue/todayspaper/2019/05/16/todays-new-york-times,/2019/05/15/us/midwest-flooding-climate-change.html,"In Flood-Hit Midwest, Mayors See Climate Change as a Subject Best Avoided",2019/05/16,us
https://www.nytimes.com/issue/todayspaper/2019/05/16/todays-new-york-times,/2019/05/15/business/us-china-trade-war-economy.html,The Global Economy Was Improving. Then the Fighting Resumed.,2019/05/16,business
https://www.nytimes.com/issue/todayspaper/2019/05/16/todays-new-york-times,/2019/05/15/world/asia/india-elections-women-voters.html,"In India’s Elections, Female Candidates Still Need Men’s Blessings",2019/05/16,world
https://www.nytimes.com/issue/todayspaper/2019/05/16/todays-new-york-times,/2019/05/15/us/politics/senate-confirmations-legislation.html,Senate’s Churn of Confirmations Brings Complaints of a ‘Legislative Graveyard’,2019/05/16,us
https://www.nytimes.com/issue/todayspaper/2019/05/16/todays-new-york-times,/2019/05/15/health/evolus-wrinkles-toxin-jeuveau.html,"A Rival to Botox Invites Doctors to Party in Cancun, With Fireworks, Confetti and Social Media Posts",2019/05/16,health
https://www.nytimes.com/issue/todayspaper/2019/05/16/todays-new-york-times,/2019/05/15/arts/jeff-koons-rabbit-auction.html,Jeff Koons ‘Rabbit’ Sets Auction Record for Most Expensive Work by Living Artist,2019/05/16,arts
https://www.nytimes.com/issue/todayspaper/2019/05/17/todays-new-york-times,/2019/05/16/world/middleeast/iran-war-donald-trump.html,Trump Tells Pentagon Chief He Does Not Want War With Iran,2019/05/17,world
https://www.nytimes.com/issue/todayspaper/2019/05/17/todays-new-york-times,/2019/05/16/world/asia/trade-xi-jinping-trump-china-united-states.html,How Xi’s Last-Minute Switch on U.S.-China Trade Deal Upended It,2019/05/17,world
https://www.nytimes.com/issue/todayspaper/2019/05/17/todays-new-york-times,/2019/05/16/nyregion/eric-garner-pantaleo-trial.html,"Eric Garner Death Was ‘Not a Big Deal,’  Police Commander Said",2019/05/17,nyregion
https://www.nytimes.com/issue/todayspaper/2019/05/17/todays-new-york-times,/2019/05/16/us/sat-score.html,SAT’s New ‘Adversity Score’ Will Take Students’ Hardships Into Account,2019/05/17,us
https://www.nytimes.com/issue/todayspaper/2019/05/17/todays-new-york-times,/2019/05/16/obituaries/im-pei-dead.html,"I.M. Pei, Master Architect Whose Buildings Dazzled the World, Dies at 102",2019/05/17,obituaries
https://www.nytimes.com/issue/todayspaper/2019/05/17/todays-new-york-times,/2019/05/16/nyregion/bill-de-blasio-president.html,Mayor Bill de Blasio Enters 2020 Race for President,2019/05/17,nyregion
https://www.nytimes.com/issue/todayspaper/2019/05/17/todays-new-york-times,/interactive/2019/05/17/us/sarah-zorn-citadel-commander.html,"The First Woman to Lead 2,400 Citadel Cadets",2019/05/17,us
https://www.nytimes.com/issue/todayspaper/2019/05/17/todays-new-york-times,/2019/05/16/technology/huawei-ban-president-trump.html,Trump’s Latest Move Takes Straight Shot at Huawei’s Business,2019/05/17,technology
https://www.nytimes.com/issue/todayspaper/2019/05/17/todays-new-york-times,/2019/05/16/us/abortion-law-women.html,"In Alabama, Opposition to Abortion Runs Deep",2019/05/17,us
https://www.nytimes.com/issue/todayspaper/2019/05/17/todays-new-york-times,/2019/05/16/us/politics/impeaching-president-trump.html,Frustrated House Democrats Pin Their Hopes on Mueller,2019/05/17,us
https://www.nytimes.com/issue/todayspaper/2019/05/17/todays-new-york-times,/2019/05/16/us/immigrants-undocumented-no-match.html,Letters From Washington: Your Employees Could Be Undocumented,2019/05/17,us
https://www.nytimes.com/issue/todayspaper/2019/05/17/todays-new-york-times,/2019/05/16/world/middleeast/lebanon-basketball-sectarian-politics.html,"Basketball Is ‘War, Minus the Shooting’ in Sectarian Lebanon",2019/05/17,world
https://www.nytimes.com/issue/todayspaper/2019/05/17/todays-new-york-times,/2019/05/16/world/europe/matteo-salvini-italy-eu-parliament.html,Matteo Salvini’s Permanent Campaign Turns to European Parliament,2019/05/17,world
https://www.nytimes.com/issue/todayspaper/2019/05/17/todays-new-york-times,/2019/05/16/business/india-modi-election-economy.html,Modi Promised Better Days and Bridges. India’s Voters Are Still Waiting.,2019/05/17,business
https://www.nytimes.com/issue/todayspaper/2019/05/17/todays-new-york-times,/2019/05/16/upshot/how-to-prepare-for-the-next-recession-automate-the-rescue-plan.html,How to Prepare for the Next Recession: Automate the Rescue Plan,2019/05/17,upshot
https://www.nytimes.com/issue/todayspaper/2019/05/17/todays-new-york-times,/2019/05/16/sports/pga-championship-brooks-koepka.html,"Brooks Koepka, Happily in the Shadows, Sets Bethpage Black Record",2019/05/17,sports
https://www.nytimes.com/issue/todayspaper/2019/05/17/todays-new-york-times,/2019/05/15/sports/dick-garrett-bucks-security-guard-usher.html,Why Does a Bucks Security Guard Look Familiar? He Used to Play for the Team,2019/05/17,sports
https://www.nytimes.com/issue/todayspaper/2019/05/17/todays-new-york-times,/2019/05/16/arts/television/fleabag-amazon-review.html,"Review: As She Was Saying, Brilliantly, in a New ‘Fleabag’",2019/05/17,arts
https://www.nytimes.com/issue/todayspaper/2019/05/18/todays-new-york-times,/2019/05/17/us/politics/china-auto-tariffs-donald-trump.html,"Trump Lifts Metal Tariffs and Delays Auto Levies, Limiting Global Trade Fight",2019/05/18,us
https://www.nytimes.com/issue/todayspaper/2019/05/18/todays-new-york-times,/2019/05/17/us/politics/trump-iran-nuclear-deal.html,"To Contain Iran, Trump’s Newest Line in the Sand Looks a Lot Like Obama’s",2019/05/18,us
https://www.nytimes.com/issue/todayspaper/2019/05/18/todays-new-york-times,/2019/05/17/world/americas/venezuela-economy.html,"Venezuela’s Collapse Is the Worst Outside of War in Decades, Economists Say",2019/05/18,world
https://www.nytimes.com/issue/todayspaper/2019/05/18/todays-new-york-times,/2019/05/17/us/bernie-sanders-burlington-mayor.html,Mayor and ‘Foreign Minister’: How Bernie Sanders Brought the Cold War to Burlington,2019/05/18,us
https://www.nytimes.com/issue/todayspaper/2019/05/18/todays-new-york-times,/2019/05/17/arts/metoo-unions-ballet-ramasar.html,Caught in the Middle of #MeToo: Unions That Represent Accusers and Accused,2019/05/18,arts
https://www.nytimes.com/issue/todayspaper/2019/05/18/todays-new-york-times,/2019/05/17/health/antibiotics-oranges-florida.html,"Citrus Farmers Facing Deadly Bacteria Turn to Antibiotics, Alarming Health Officials",2019/05/18,health
https://www.nytimes.com/issue/todayspaper/2019/05/18/todays-new-york-times,/2019/05/17/world/europe/war-iran-europe-iraq.html,"War With Iran? Count Us Out, Europe Says",2019/05/18,world
https://www.nytimes.com/issue/todayspaper/2019/05/18/todays-new-york-times,/2019/05/17/world/europe/turkey-economy-istanbul-election.html,Risk to Turkey’s Economy Deepens With New Istanbul Election,2019/05/18,world
https://www.nytimes.com/issue/todayspaper/2019/05/18/todays-new-york-times,/2019/05/14/us/golden-spike-utah-railroad-150th-anniversary.html,Chinese Railroad Workers Were Almost Written Out of History. Now They’re Getting Their Due.,2019/05/18,us
https://www.nytimes.com/issue/todayspaper/2019/05/18/todays-new-york-times,/2019/05/17/world/americas/colombia-farc-peace-deal.html,Colombia’s Peace Deal Promised a New Era. So Why Are These Rebels Rearming?,2019/05/18,world
https://www.nytimes.com/issue/todayspaper/2019/05/18/todays-new-york-times,/2019/05/17/us/missouri-abortion-law.html,Missouri Lawmakers Pass Bill Criminalizing Abortion at About 8 Weeks of Pregnancy,2019/05/18,us
https://www.nytimes.com/issue/todayspaper/2019/05/18/todays-new-york-times,/2019/05/17/sports/ohio-state-sexual-abuse.html,Ohio State Finds Team Doctor Sexually Abused 177 Students,2019/05/18,sports
https://www.nytimes.com/issue/todayspaper/2019/05/18/todays-new-york-times,/2019/05/17/nyregion/mta-overtime.html,"$461,646 in Pay for One Worker: M.T.A. Overtime Scrutinized by Prosecutors",2019/05/18,nyregion
https://www.nytimes.com/issue/todayspaper/2019/05/18/todays-new-york-times,/2019/05/17/business/boeing-737-max-simulators.html,Boeing 737 Max Simulators Are in High Demand. They Are Flawed.,2019/05/18,business
https://www.nytimes.com/issue/todayspaper/2019/05/18/todays-new-york-times,/2019/05/17/sports/brooks-koepka-makes-history-on-day-2-of-the-pga-championship.html,Brooks Koepka Makes History on Day 2 of the P.G.A. Championship,2019/05/18,sports
https://www.nytimes.com/issue/todayspaper/2019/05/18/todays-new-york-times,/2019/05/16/arts/television/binge-watch-game-of-thrones.html,I Ignored ‘Game of Thrones’ for 8 Years. Then Inhaled It in 5 Weeks.,2019/05/18,arts
https://www.nytimes.com/issue/todayspaper/2019/05/18/todays-new-york-times,/2019/05/17/obituaries/herman-wouk-dead.html,"Herman Wouk, Best-Selling Novelist With a Realist’s Touch, Dies at 103",2019/05/18,obituaries
https://www.nytimes.com/issue/todayspaper/2019/05/18/todays-new-york-times,/2019/05/14/style/enjoy-the-silence.html,1994 Was a Prison of My Own Making,2019/05/18,style
https://www.nytimes.com/issue/todayspaper/2019/05/19/todays-new-york-times,/2019/05/18/world/americas/colombian-army-killings.html,Colombia Army’s New Kill Orders Send Chills Down Ranks,2019/05/19,world
https://www.nytimes.com/issue/todayspaper/2019/05/19/todays-new-york-times,/2019/05/19/nyregion/nyc-taxis-medallions-suicides.html,‘They Were Conned’: How Reckless Loans Devastated a Generation of Taxi Drivers,2019/05/19,nyregion
https://www.nytimes.com/issue/todayspaper/2019/05/19/todays-new-york-times,/2019/05/18/world/europe/austria-strache-resigns-video.html,Austrian Leader Calls for Snap Election After Far-Right Vice Chancellor Resigns,2019/05/19,world
https://www.nytimes.com/issue/todayspaper/2019/05/19/todays-new-york-times,/2019/05/18/health/heroin-fentanyl-deaths-baltimore.html,"In Cities Where It Once Reigned, Heroin Is Disappearing",2019/05/19,health
https://www.nytimes.com/issue/todayspaper/2019/05/19/todays-new-york-times,/2019/05/18/arts/television/game-of-thrones-season-8.html,‘Game of Thrones’ Is Going Out Fighting. So Will Its Audience.,2019/05/19,arts
https://www.nytimes.com/issue/todayspaper/2019/05/19/todays-new-york-times,/2019/05/18/world/australia/election-results-scott-morrison.html,Australia Election Results: Prime Minister Scott Morrison Seizes a Stunning Win,2019/05/19,world
https://www.nytimes.com/issue/todayspaper/2019/05/19/todays-new-york-times,/2019/05/18/us/trump-pardons-war-crimes.html,Trump May Be Preparing Pardons for Servicemen Accused of War Crimes,2019/05/19,us
https://www.nytimes.com/issue/todayspaper/2019/05/19/todays-new-york-times,/2019/05/17/us/politics/kirsten-gillibrand-abortion.html,Kirsten Gillibrand Is Struggling. Will Abortion Rights Be Her Rallying Cry?,2019/05/19,us
https://www.nytimes.com/issue/todayspaper/2019/05/19/todays-new-york-times,/2019/05/17/technology/facebook-ai-schroepfer.html,Facebook’s A.I. Whiz Now Faces the Task of Cleaning It Up. Sometimes That Brings Him to Tears.,2019/05/19,technology
https://www.nytimes.com/issue/todayspaper/2019/05/19/todays-new-york-times,/2019/05/18/sports/pga-championship-brooks-koepka.html,Running Away With the P.G.A. Championship Is All in a Day’s Work for Brooks Koepka,2019/05/19,sports
https://www.nytimes.com/issue/todayspaper/2019/05/19/todays-new-york-times,/2019/05/15/t-magazine/morocco-travel-draa-valley.html,In Search of Ancient Morocco,2019/05/19,
https://www.nytimes.com/issue/todayspaper/2019/05/19/todays-new-york-times,/2019/05/15/t-magazine/myanmar-travel-quandary-essay.html,The Quandary of Myanmar: Will Starving the Country of Visitors Make Things Better?,2019/05/19,
https://www.nytimes.com/issue/todayspaper/2019/05/19/todays-new-york-times,/2019/05/13/t-magazine/greece-ithaca-visit.html,A Journey Into Greece’s Land of a Thousand Stories,2019/05/19,
https://www.nytimes.com/issue/todayspaper/2019/05/20/todays-new-york-times,/2019/05/19/world/africa/ebola-outbreak-congo.html,Fighting Ebola When Mourners Fight the Responders,2019/05/20,world
https://www.nytimes.com/issue/todayspaper/2019/05/20/todays-new-york-times,/2019/05/19/nyregion/taxi-medallions.html,"As Thousands of Taxi Drivers Were Trapped in Loans, Top Officials Counted the Money",2019/05/20,nyregion
https://www.nytimes.com/issue/todayspaper/2019/05/20/todays-new-york-times,/2019/05/19/business/deutsche-bank-trump-kushner.html,Deutsche Bank Staff Saw Suspicious Activity in Trump and Kushner Accounts,2019/05/20,business
https://www.nytimes.com/issue/todayspaper/2019/05/20/todays-new-york-times,/2019/05/19/nyregion/eric-garner-case.html,Why a Witness to Eric Garner’s Death Is Giving Up on ‘Justice’,2019/05/20,nyregion
https://www.nytimes.com/issue/todayspaper/2019/05/20/todays-new-york-times,/2019/05/19/us/politics/republicans-abortion-economy-issues.html,"Abortion Fight or Strong Economy? For G.O.P., Cultural Issues Undercut 2020 Message",2019/05/20,us
https://www.nytimes.com/issue/todayspaper/2019/05/20/todays-new-york-times,/2019/05/19/education/morehouse-college-robert-f-smith.html,Morehouse College Graduates’ Student Loans to Be Paid Off by Billionaire,2019/05/20,education
https://www.nytimes.com/issue/todayspaper/2019/05/20/todays-new-york-times,/2019/05/19/world/europe/want-to-relax-try-the-spa-in-a-salt-mine-in-belarus.html,Want to Relax? Try the Spa in a Salt Mine in Belarus,2019/05/20,world
https://www.nytimes.com/issue/todayspaper/2019/05/20/todays-new-york-times,/2019/05/19/world/europe/european-parliament-elections-populists.html,European Elections Will Gauge the Power of Populism,2019/05/20,world
https://www.nytimes.com/issue/todayspaper/2019/05/20/todays-new-york-times,/2019/05/19/us/politics/voting-age.html,"16-Year-Olds Want a Vote. Fifty Years Ago, So Did 18-Year-Olds.",2019/05/20,us
https://www.nytimes.com/issue/todayspaper/2019/05/20/todays-new-york-times,/2019/05/19/us/chicago-mayor-rahm-emanuel.html,"Rahm Emanuel, Chicago’s Departing Mayor, in His Own Words",2019/05/20,us
https://www.nytimes.com/issue/todayspaper/2019/05/20/todays-new-york-times,/2019/05/17/nyregion/mayor-bill-de-blasio-campaign.html,Who Runs New York When the Mayor Campaigns for President?,2019/05/20,nyregion
https://www.nytimes.com/issue/todayspaper/2019/05/20/todays-new-york-times,/2019/05/19/business/media/rocketman-elton-john-paramount.html,"As ‘Rocketman’ Prepares to Take Off, Hollywood Holds Its Breath",2019/05/20,business
https://www.nytimes.com/issue/todayspaper/2019/05/20/todays-new-york-times,/2019/05/19/business/media/social-media-presidential-campaign-2020.html,"Kissing Babies, Loving Scrapple, Fighting Viral Hoaxes: ’20 Race’s New Routine",2019/05/20,business
https://www.nytimes.com/issue/todayspaper/2019/05/20/todays-new-york-times,/2019/05/19/sports/brooks-koepka-pga-championship.html,P.G.A. Championship: Koepka Lets Lead Evaporate but Hangs On to Win,2019/05/20,sports
https://www.nytimes.com/issue/todayspaper/2019/05/20/todays-new-york-times,/2019/05/19/sports/draymond-green-warriors.html,Draymond Green Has Never Been Better. Or This Quiet.,2019/05/20,sports
https://www.nytimes.com/issue/todayspaper/2019/05/21/todays-new-york-times,/2019/05/20/climate/epa-air-pollution-deaths.html,E.P.A. Plans to Get Thousands of Pollution Deaths Off the Books by Changing Its Math,2019/05/21,climate
https://www.nytimes.com/issue/todayspaper/2019/05/21/todays-new-york-times,/2019/05/20/business/huawei-trump-china-trade.html,"As Huawei Loses Google, the U.S.-China Tech Cold War Gets Its Iron Curtain",2019/05/21,business
https://www.nytimes.com/issue/todayspaper/2019/05/21/todays-new-york-times,/2019/05/20/us/politics/mcgahn-trump-congress.html,Trump’s Secrecy Fight Escalates as Judge Rules for Congress in Early Test,2019/05/21,us
https://www.nytimes.com/issue/todayspaper/2019/05/21/todays-new-york-times,/2019/05/20/us/politics/hes-one-of-the-biggest-backers-of-trumps-push-to-protect-american-steel-and-hes-canadian.html,He’s One of the Biggest Backers of Trump’s Push to Protect American Steel. And He’s Canadian.,2019/05/21,us
https://www.nytimes.com/issue/todayspaper/2019/05/21/todays-new-york-times,/2019/05/20/nyregion/nyc-taxi-medallion-loans-attorney-general.html,Inquiries Into Reckless Loans to Taxi Drivers Ordered by State Attorney General and Mayor,2019/05/21,nyregion
https://www.nytimes.com/issue/todayspaper/2019/05/21/todays-new-york-times,/2019/05/20/world/asia/modi-india-election.html,The Choice in India: ‘Our Trump’ or a Messier Democracy,2019/05/21,world
https://www.nytimes.com/issue/todayspaper/2019/05/21/todays-new-york-times,/2019/05/20/technology/google-android-huawei.html,"U.S. Tech Suppliers, Including Google, Restrict Dealings With Huawei After Trump Order",2019/05/21,technology
https://www.nytimes.com/issue/todayspaper/2019/05/21/todays-new-york-times,/2019/05/20/world/australia/australia-china.html,Australia’s China Challenge,2019/05/21,world
https://www.nytimes.com/issue/todayspaper/2019/05/21/todays-new-york-times,/2019/05/21/world/europe/emmanuel-macron-europe-elections.html,Emmanuel Macron’s Grand Ambitions Are at Stake in European Elections,2019/05/21,world
https://www.nytimes.com/issue/todayspaper/2019/05/21/todays-new-york-times,/2019/05/21/nyregion/catholic-church-sexual-abuse.html,They Hoped the Catholic Church Would Reveal Their Abusers. They Are Still Waiting.,2019/05/21,nyregion
https://www.nytimes.com/issue/todayspaper/2019/05/21/todays-new-york-times,/2019/05/20/us/lori-lightfoot-inauguration.html,New Mayor Lori Lightfoot Vows Death to ‘Kissing-the-Ring’ Chicago Rules,2019/05/21,us
